,show_id,type,title,director,cast,country,date_added,release_year,rating,duration,listed_in,description
2818,70224969,Movie,Felipe Esparza: They're Not Going to Laugh at You,Scott L. Montoya,Felipe Esparza,United States,"July 3, 2018",2012,NR,58 min,Stand-Up Comedy,"""Last Comic Standing"" winner Felipe Esparza runs riot in his first comedy special with his wry comments on life as a wild man from East Los Angeles."
2819,70261273,Movie,Joan Rivers: Don't Start with Me,Scott L. Montoya,Joan Rivers,United States,"July 3, 2018",2012,TV-MA,69 min,Stand-Up Comedy,"At 78, Joan Rivers has no interest in slowing down, and no one's immune from her caustic barbs in this stand-up special."
2820,70250364,Movie,Katt Williams: Kattpacalypse,Marcus Raboy,Katt Williams,United States,"July 3, 2018",2012,NR,61 min,Stand-Up Comedy,"Urban comic Katt Williams ushers in Kattpacalypse, exploding with more energy than an atomic bomb and riffing on everything from Doomsday to Obama."
2824,70278933,Movie,Her,Spike Jonze,"Joaquin Phoenix, Scarlett Johansson, Amy Adams, Rooney Mara, Olivia Wilde, Chris Pratt, Matt Letscher, Portia Doubleday",United States,"July 29, 2018",2013,R,126 min,"Dramas, Romantic Movies, Sci-Fi & Fantasy",Love comes to a lonely writer in the sleekest of packages when he finds himself falling for the advanced operating system he bought to run his life.
2825,80093198,Movie,Tallulah,Sian Heder,"Ellen Page, Allison Janney, Tammy Blanchard, Evan Jonigkeit, Uzo Aduba, John Benjamin Hickey, David Zayas, Zachary Quinto, Fredric Lehne",United States,"July 29, 2016",2016,TV-MA,112 min,"Dramas, Independent Movies","While searching for her ex-boyfriend, a young drifter impulsively kidnaps a baby from a neglectful mother and pretends the child is her own."
2828,70124965,Movie,The Company Men,John Wells,"Ben Affleck, Chris Cooper, Kevin Costner, Tommy Lee Jones, Maria Bello, Rosemarie DeWitt, Craig T. Nelson, John Doman, Tonye Patano, Cady Huffman",United States,"July 28, 2018",2010,R,105 min,"Dramas, Independent Movies",A successful businessman comes face-to-face with America's downsizing epidemic when he loses his job and is forced to take a construction gig.
2833,80171022,Movie,The Incredible Jessica James,Jim Strouse,"Jessica Williams, Chris O'Dowd, Lakeith Stanfield, Noël Wells, Taliyah Whitaker, Zabryna Guevara, Sarah Jones, Will Stephen, Susan Heyward, Megan Ketch",United States,"July 28, 2017",2017,TV-MA,84 min,"Comedies, Independent Movies, Romantic Movies","Burned by a bad breakup, a struggling New York City playwright makes an unlikely connection with a divorced app designer she meets on a blind date."
2835,80236421,Movie,Extinction,Ben Young,"Michael Peña, Lizzy Caplan, Israel Broussard, Mike Colter, Emma Booth, Lex Shrapnel, Erica Tremblay, Lilly Aspell",United States,"July 27, 2018",2018,TV-MA,95 min,"Action & Adventure, Dramas, Sci-Fi & Fantasy","Plagued by dreams of an alien invasion, a family man faces his worst nightmare when an extraterrestrial force begins exterminating Earth's inhabitants."
2839,81092331,Movie,1st Summoning,Raymond Wood,"Hayley Lovitt, Teddy Cole, Brook Todd, Ace Harney, Jason Macdonald",United States,"July 26, 2019",2018,TV-MA,94 min,"Horror Movies, Independent Movies","Student filmmakers uncover occult rituals tied to an abandoned warehouse, then gradually realize the horror is closer than they think."
2852,80049177,Movie,Barely Lethal,Kyle Newman,"Hailee Steinfeld, Jessica Alba, Samuel L. Jackson, Sophie Turner, Dove Cameron, Toby Sebastian, Gabriel Basso, Thomas Mann, Rachael Harris, Dan Fogler, Steve-O, Rob Huebel, Finesse Mitchell, Jaime King",United States,"July 26, 2018",2015,PG-13,99 min,"Action & Adventure, Comedies",A girl raised to be a government assassin just wants to be a normal teen – so she runs away and pretends to be a high school exchange student.
2856,80038337,Movie,Mississippi Grind,"Anna Boden, Ryan Fleck","Ryan Reynolds, Ben Mendelsohn, Sienna Miller, Analeigh Tipton, Alfre Woodard, James Toback, Robin Weigert",United States,"July 26, 2018",2015,R,109 min,"Dramas, Independent Movies",A gambler mired in debt thinks another cardsharp may just be his good luck charm as the two head for New Orleans to buy into a high-stakes poker game.
2857,80053475,Movie,Mojave,William Monahan,"Garrett Hedlund, Oscar Isaac, Louise Bourgoin, Walton Goggins, Mark Wahlberg, Fran Kranz",United States,"July 26, 2018",2015,R,93 min,"Dramas, Independent Movies, Thrillers",A lethal game of cat and mouse stretches from the desert to Tinseltown after Hollywood bad boy Thomas runs afoul of a cunning and dangerous drifter.
2861,80037478,Movie,The End of the Tour,James Ponsoldt,"Jason Segel, Jesse Eisenberg, Becky Ann Baker, Anna Chlumsky, Joan Cusack, Mamie Gummer, Ron Livingston, Mickey Sumner",United States,"July 26, 2018",2015,R,106 min,"Dramas, Independent Movies","""Rolling Stone"" reporter David Lipsky shadows famed writer David Foster Wallace in this fictionalized account of their revealing five-day encounter."
2872,80185321,Movie,Joe Mande’s Award-Winning Comedy Special,Daniel Gray Longino,Joe Mande,United States,"July 25, 2017",2017,TV-MA,67 min,Stand-Up Comedy,"Stand-up comic Joe Mande aims for critical adulation with this special that covers dating shows, ""Shark Tank,"" Jewish summer camp and much more."
2873,70298116,Movie,Lizzie Borden Took an Ax,Nick Gomez,"Christina Ricci, Clea DuVall, Gregg Henry, Stephen McHattie, Shawn Doyle, Sara Botsford, Hannah Emily Anderson, Andrea Runge, Billy Campbell, Jennifer Kydd, Kirstin Howell, John Maclaren",United States,"July 25, 2016",2014,TV-14,87 min,Thrillers,"This made-for-TV drama chronicles the scandal and enduring mystery surrounding Lizzie Borden, who was tried in 1892 for axing her parents to death."
2875,80213658,Movie,Iliza Shlesinger: Elder Millennial,Steve Paley,Iliza Shlesinger,United States,"July 24, 2018",2018,TV-MA,72 min,Stand-Up Comedy,"Newly engaged comic Iliza Shlesinger dives into undeniable truths about life at age 35, the insanity of the road traveled and what's to come."
2877,80014857,Movie,Tusk,Kevin Smith,"Michael Parks, Justin Long, Haley Joel Osment, Genesis Rodriguez, Johnny Depp, Harley Morenstein, Ralph Garman, Jennifer Schwalbach",United States,"July 24, 2018",2014,R,102 min,Horror Movies,"When a wise-guy podcaster interviews a disabled seafarer, he decides to embark on a transformational quest to track down a dangerous walrus-monster."
2879,80145512,Movie,Victor,Brandon Dickerson,"Patrick Davis, Lisa Vidal, Josh Pence, José Zúñiga, Haley Ramm, Matt Angel, J. Michael Trautmann, Lobo Sebastian",United States,"July 24, 2017",2015,PG-13,110 min,Dramas,"In 1962 Brooklyn, a Puerto Rican teen who joins a gang is seduced by violence and heroin. But can his mother's love and faith in God save him?"
2881,80225024,Movie,The Competition,Harvey Lowry,"Thora Birch, Chris Klein, Claire Coffee, David Blue, Kelsey Tucker, Michael Draper, Jason Tobias, Gabrielle Stone, Catherine Johnson, Tiffany Fallon",United States,"July 23, 2019",2018,TV-14,103 min,"Comedies, Romantic Movies","After developing an ""infidelity formula"" said to repel cheating, a popular blogger crosses paths with a charming lawyer willing to put it to the test."
2888,70099615,Movie,Bolt,"Byron Howard, Chris Williams","John Travolta, Miley Cyrus, Susie Essman, Mark Walton, Malcolm McDowell, James Lipton, Greg Germann, Diedrich Bader, Nick Swardson, J.P. Manoux, Dan Fogelman, Kari Wahlgren, Chloë Grace Moretz, Randy Savage, Ronn Moss, John DiMaggio, Daran Norris, Jeff Bennett, Brian Stepanek, Todd Cummings",United States,"July 22, 2018",2008,PG,99 min,"Children & Family Movies, Comedies","This tale follows German shepherd Bolt, a canine actor who makes a cross-country trek when he's mistakenly shipped from Hollywood to New York City."
2891,80213654,Movie,D.L. Hughley: Contrarian,Jay Chapman,D.L. Hughley,United States,"July 21, 2019",2018,TV-MA,58 min,Stand-Up Comedy,"D.L. Hughley riffs on hot-button political issues, celebrity scandals, his mother's tough love and more in a rapid-fire stand-up show in Philadelphia."
2892,80158802,Movie,Demetri Martin: The Overthinker,"Jay Karas, Demetri Martin",Demetri Martin,United States,"July 21, 2019",2018,TV-MA,56 min,Stand-Up Comedy,"With his signature one-liners and drawings, Demetri Martin muses on doughnut holes, dogs, sports bars, the alphabet's most aggressive letters and more."
2897,70299270,Movie,Life After Beth,Jeff Baena,"Aubrey Plaza, Dane DeHaan, John C. Reilly, Molly Shannon, Cheryl Hines, Paul Reiser, Matthew Gray Gubler, Anna Kendrick, Paul Weitz",United States,"July 21, 2018",2014,R,89 min,"Comedies, Horror Movies, Independent Movies","Following the death of his beloved girlfriend, Beth, Zach is first shattered and then overjoyed when she inexplicably comes back to life."
2900,80107087,Movie,Internet Famous,Michael Gallagher,"Shane Dawson, Steve Greene, Amanda Cerny, Christian Delgrosso, Wendy McColm, Richard Ryan, Roger Bart, John Michael Higgins, Missi Pyle, Jimmy Tatro, Tay Zonday, Adam Busch",United States,"July 21, 2016",2016,TV-14,87 min,Comedies,Five viral Internet celebrities travel to a competition that will award one of them their own television series in this ensemble comedy.
2920,81092325,Movie,Iron Cowboy: The Story of the 50.50.50,Jacob Schwab,James Lawrence,United States,"July 19, 2019",2018,TV-14,77 min,"Documentaries, Sports Movies","A record-setting triathlete dares to complete 50 Ironman races – a 2.4-mile swim, a 112-mile bike ride, and a 26.2-mile run – in 50 days in 50 states."
2924,70053885,Movie,Katt Williams: Live,Alphonso J. Wesson,Katt Williams,United States,"July 19, 2018",2006,NR,85 min,Stand-Up Comedy,"Outspoken comedian Katt Williams pokes fun at a variety of topics, including sex, relationships, parenthood and trying to make it as an entertainer."
2925,70301275,Movie,Obvious Child,Gillian Robespierre,"Jenny Slate, Jake Lacy, Gaby Hoffmann, Gabe Liedman, Polly Draper, Richard Kind, David Cross, Paul Briganti, Stephen Singer, Cindy Cheung, Jennifer Kim, Cyrus McQueen, Emily Tremaine, Ernest Mingione",United States,"July 19, 2018",2014,R,84 min,"Comedies, Dramas, Independent Movies","After being fired from her job and dumped by her cheating boyfriend, a comedian has a one-night stand. Weeks later, she finds out she's pregnant."
2927,70299859,Movie,Say When,Lynn Shelton,"Keira Knightley, Chloë Grace Moretz, Sam Rockwell, Kaitlyn Dever, Jeff Garlin, Ellie Kemper, Mark Webber, Daniel Zovatto, Kevin Seal, Ernie Joseph, Louis Hobson, Dylan Arnold, Mari Nelson, Sean Nelson, Omar Silva, Aaron Washington, Sara Coates, Gretchen Mol, Basil Harris",United States,"July 19, 2018",2014,R,99 min,"Comedies, Dramas, Independent Movies","Desperately clinging to her youth, 28-year-old Megan tells her boyfriend she's attending a career seminar but hangs out with a teenage friend instead."
2930,1005494,Movie,The Stranger,Orson Welles,"Edward G. Robinson, Loretta Young, Orson Welles, Philip Merivale, Richard Long, Konstantin Shayne, Byron Keith, Billy House",United States,"July 19, 2018",1946,TV-PG,94 min,"Classic Movies, Dramas, Thrillers",A Nazi fugitive hiding in Connecticut tries to keep his identity hidden from his naïve new wife while a dogged investigator pursues him relentlessly.
2932,80998968,Movie,Secret Obsession,Peter Sullivan,"Brenda Song, Mike Vogel, Dennis Haysbert, Ashley Scott, Paul Sloan, Daniel Booko",United States,"July 18, 2019",2019,TV-14,98 min,Thrillers,"When Jennifer wakes up with amnesia after a traumatic attack, her doting husband cares for her. But she soon realizes the danger is far from over."
2933,70272893,Movie,Short Term 12,Destin Daniel Cretton,"Brie Larson, John Gallagher Jr., Kaitlyn Dever, Rami Malek, Lakeith Stanfield, Kevin Hernandez, Melora Walters, Stephanie Beatriz, Lydia Du Veaux, Alex Calloway, Frantz Turner",United States,"July 18, 2019",2013,R,97 min,"Dramas, Independent Movies","A new charge at a foster care facility dredges up the memories of a young supervisor's own troubled past, and her tough exterior begins eroding."
2938,80192842,TV Show,Ari Shaffir: Double Negative,Eric Abrams,Ari Shaffir,United States,"July 18, 2017",2017,TV-MA,1 Season,Stand-Up Comedy & Talk Shows,"Wry yet thoughtful, comedian Ari Shaffir brings his edgy humor to two fast-paced stand-up specials about children and adulthood."
2944,80028208,Movie,Tig,"Kristina Goolsby, Ashley York",Tig Notaro,United States,"July 17, 2015",2015,TV-14,92 min,"Documentaries, Stand-Up Comedy",Comedian Tig Notaro announced her cancer diagnosis at what became a legendary stand-up set in 2012. Follow her search for humor amid devastating news.
2946,81003981,Movie,"Frankenstein’s Monster’s Monster, Frankenstein",Daniel Gray Longino,"David Harbour, Alex Ozerov, Kate Berlant, Mary Woronov, Alfred Molina, Heather Lawless, Michael Lerner, Marion Van Cuyck, Bridey Elliott, O-Lan Jones, Lidia Porto, Graham Wagner, Randolph Thompson",United States,"July 16, 2019",2019,TV-14,32 min,Comedies,"When actor David Harbour finds lost footage of his father's disastrous televised stage play of a literary classic, he uncovers shocking family secrets."
2948,70042688,Movie,The Break-Up,Peyton Reed,"Vince Vaughn, Jennifer Aniston, Joey Lauren Adams, Cole Hauser, Jon Favreau, Jason Bateman, Judy Davis, Justin Long, Ivan Sergei, John Michael Higgins, Ann-Margret, Vernon Vaughn, Vincent D'Onofrio",United States,"July 16, 2019",2006,PG-13,107 min,"Comedies, Dramas, Romantic Movies",Cohabitating couple Gary and Brooke's petty spats turn into an all-out battle for their home condo.
2949,70109429,Movie,The Princess and the Frog,"Ron Clements, John Musker","Anika Noni Rose, Bruno Campos, Keith David, Michael-Leon Wooley, Jennifer Cody, Jim Cummings, Peter Bartlett, Jenifer Lewis, Oprah Winfrey, Terrence Howard, John Goodman, Emeril Lagasse, June Christopher, Paul Briggs, Rob Edwards, John Kassir, Fred Tatasciore, Kimberly Russell, Rif Hutton, Randy Newman, Bridget Hoffman, Corey Burton, Joe Whyte, Michael Colyar, Bruce Smith, Terri Douglas, Claudette Wells, Roger Aaron Brown, Mona Marshall, Terence Blanchard, Kwesi Boakye, Mick Wingert, David Cowgill, Peter Renaday, John Musker, Ritchie Montgomery, Jerry Kernion, Philip Proctor, Eddie Frierson",United States,"July 16, 2019",2009,G,98 min,Children & Family Movies,"In New Orleans during the Jazz Age, a beautiful girl named Tiana has a fateful encounter with frog prince who desperately wants to be human again."
2950,81011993,Movie,We Belong Together,Chris Stokes,"Charles Malik Whitfield, Draya Michele, Elise Neal, Cassidey Fralin, Brian White, Valarie Pettiford, Gary Anthony Sturgis, Jessica Vanessa DeLeon",United States,"July 16, 2019",2018,TV-14,83 min,Thrillers,A divorced professor shares a night of passion with a troubled student who quickly develops an unhealthy – perhaps deadly – infatuation.
2956,81153373,Movie,Love Shot,Steven Fine,"Dakota Loesch, Amy Tsang, John Kapelos, Cruz Kim, Victor J. Ho, Clint Jung, Daniel Phai, Cindy Chu, Brian Kurtis, Pete Herron",United States,"July 15, 2019",2018,TV-MA,77 min,"Dramas, Thrillers",A charming hitman questions his profession after learning his next target is the karaoke singer he’s falling in love with.
2957,70262783,Movie,A Glimpse Inside the Mind of Charles Swan III,Roman Coppola,"Charlie Sheen, Jason Schwartzman, Bill Murray, Katheryn Winnick, Patricia Arquette, Aubrey Plaza, Mary Elizabeth Winstead, Dermot Mulroney",United States,"July 15, 2018",2012,R,86 min,"Comedies, Independent Movies","When his girlfriend walks out and leaves him a wreck, a graphic designer – who seemed to have it all – sets out to discover where he went wrong."
2960,80095718,Movie,Froning: The Fittest Man in History,Heber Cannon,Rich Froning,United States,"July 15, 2018",2016,PG,99 min,"Documentaries, International Movies, Sports Movies",Follow the grueling training regimen of Rich Froning Jr. as he sets his sights on winning an unprecedented fourth CrossFit Games title.
2970,80049979,Movie,The Adderall Diaries,Pamela Romanowsky,"James Franco, Ed Harris, Amber Heard, Jim Parrack, Timothée Chalamet, Wilmer Valderrama, Cynthia Nixon, Christian Slater, Michael Cristofer, Danny Flaherty, Adam LeFevre",United States,"July 15, 2018",2015,R,87 min,"Dramas, Thrillers",Author Stephen Elliott has a problem separating his own life from incidents in the life of a convicted murderer about whom he's writing a book.
2971,70267439,Movie,The Spectacular Now,James Ponsoldt,"Miles Teller, Shailene Woodley, Brie Larson, Jennifer Jason Leigh, Mary Elizabeth Winstead, Kyle Chandler, Dayo Okeniyi, Bob Odenkirk, Andre Royo, Masam Holden",United States,"July 15, 2018",2013,R,95 min,"Dramas, Independent Movies, Romantic Movies","Classmates Aimee and Sutter form an unlikely friendship, and after helping Aimee raise her social confidence, Sutter begins falling for his creation."
2976,80096585,Movie,Holidays,"Anthony Scott Burns, Nicholas McCarthy, Adam Egypt Mortimer, Gary Shore, Kevin Smith, Sarah Adina Smith, Scott Stewart, Kevin Kolsch, Dennis Widmyer","Madeleine Coghlan, Savannah Kennick, Ruth Bradley, Ava Acres, Sophie Traub, Jocelin Donahue, Harley Morenstein, Harley Quinn Smith, Ashley Greene, Olivia Roush, Seth Green, Clare Grant, Lorenza Izzo, Andrew Bowen",United States,"July 15, 2016",2016,NR,106 min,"Comedies, Horror Movies","Eight gleefully grim short tales set on Halloween, Mother's Day, St. Patrick's Day and other holidays comprise this chilling horror anthology."
2978,80064459,Movie,Rebirth,Karl Mueller,"Fran Kranz, Adam Goldberg, Nicky Whelan, Luis Gerardo Méndez, Harry Hamlin, Pat Healy, Kat Foster, Andrew J. West, Eric Ladin, Steve Agee",United States,"July 15, 2016",2016,TV-MA,101 min,"Dramas, Thrillers","Long-lost buddy Zack gets suburban dad Kyle on a bus to a Rebirth seminar, sending him down a rabbit hole of psychodrama, seduction and violence."
2979,80102204,Movie,Tony Robbins: I Am Not Your Guru,Joe Berlinger,Tony Robbins,United States,"July 15, 2016",2016,TV-MA,117 min,Documentaries,Tony Robbins' clients swear by his unorthodox life coaching methods. A revealing film goes behind the curtain at his annual mega-event.
2981,60003082,Movie,White Christmas,Michael Curtiz,"Bing Crosby, Danny Kaye, Rosemary Clooney, Vera-Ellen, Dean Jagger, Mary Wickes, John Brascia, Anne Whitfield, George Chakiris",United States,"July 15, 2012",1954,TV-G,120 min,"Children & Family Movies, Classic Movies, Comedies","Two war buddies fall for two sisters and follow the girls to a resort owned by their former commanding officer, who is in danger of losing the place."
2985,80149064,Movie,Buddy Thunderstruck: The Maybe Pile,Harry Chaskin,"Brian Atkinson, Ted Raimi, Harry Chaskin, Debi Derryberry, Philip Maurice Hayes, Leigh Kelly, J.D. Ryznar, Nick Shakoour, Ryan Wiesbrock, Clark Wiesbrock",United States,"July 14, 2017",2017,TV-PG,14 min,Movies,"Champion truck-racing dog Buddy and his best friend, ferret mechanic Darnell, paw through the ""maybe pile"" and test out a bunch of crazy stunts."
2987,80171659,Movie,To the Bone,Marti Noxon,"Lily Collins, Keanu Reeves, Carrie Preston, Lili Taylor, Alex Sharp, Liana Liberato, Brooke Smith, Leslie Bibb, Kathryn Prescott",United States,"July 14, 2017",2017,TV-MA,108 min,"Dramas, Independent Movies","Ellen, a 20-year-old with anorexia nervosa, goes on a harrowing, sometimes funny journey of self-discovery at a group home run by an unusual doctor."
2990,70306646,Movie,Creep,Patrick Brice,"Mark Duplass, Patrick Brice",United States,"July 14, 2015",2014,R,78 min,"Horror Movies, Independent Movies, Thrillers","When a cash-strapped videographer takes a job in a remote mountain town, he finds that the client has some unsettling ideas in mind."
2993,80167481,Movie,How It Ends,David M. Rosenthal,"Theo James, Forest Whitaker, Kat Graham, Nicole Ari Parker, Mark O'Brien, Grace Dove",United States,"July 13, 2018",2018,TV-MA,113 min,"Action & Adventure, Sci-Fi & Fantasy","When a mysterious disaster turns the country into a war zone, a young lawyer heads west with his future father-in-law to find his pregnant fiancée."
2994,80214743,Movie,Jim Jefferies: This Is Me Now,Scott Zabielski,Jim Jefferies,United States,"July 13, 2018",2018,TV-MA,71 min,Stand-Up Comedy,"The gleefully irreverent Jefferies skewers ""grabby"" celebrities, political hypocrisy and his own ill-advised career moves in a brash stand-up special."
2995,70270773,Movie,Kevin Hart: Let Me Explain,"Leslie Small, Tim Story",Kevin Hart,United States,"July 13, 2018",2013,R,75 min,Stand-Up Comedy,"Philadelphia funnyman Kevin Hart takes the stage in front of a sold-out crowd at Madison Square Garden, part of his hit ""Let Me Explain"" world tour."
2997,70300666,Movie,The Signal,"William Eubank, Will Eubank","Brenton Thwaites, Olivia Cooke, Laurence Fishburne, Beau Knapp, Lin Shaye, Robert Longstreet",United States,"July 13, 2018",2014,PG-13,97 min,"Sci-Fi & Fantasy, Thrillers","During their drive across the country, college pals Nick and Jonah – accompanied by Nick's girlfriend – run into major trouble in the Nevada desert."
2998,80044126,Movie,D.L. Hughley: Clear,Jay Chapman,D.L. Hughley,United States,"July 13, 2017",2014,TV-MA,59 min,Stand-Up Comedy,"In this 2014 standup special filmed in San Francisco, comedic genius D.L. Hughley entertains with his hilarious take on current affairs and more."
3000,70301023,Movie,Tom Segura: Completely Normal,Jay Chapman,Tom Segura,United States,"July 13, 2017",2014,TV-MA,74 min,Stand-Up Comedy,Levelheaded stand-up Tom Segura shares offhand appraisals on hotels and opens up about his hobbies and digestive ailments in this comedy special.
3004,81145271,Movie,Black & Privileged: Volume 1,Mark Harris,"Dawnisha Halfkenny, Simeon Henderson, Corey Hendrix, Malcom Banks, Nadia Simms, Brian White, Brely Evans, Cynda Williams, Carl Anthony Payne II",United States,"July 12, 2019",2019,TV-MA,79 min,Dramas,"When low-income families move into a thriving black community in Chicago, they find themselves at odds with politicians to maintain their status."
3018,70084221,Movie,Smart People,Noam Murro,"Dennis Quaid, Sarah Jessica Parker, Thomas Haden Church, Ellen Page, Ashton Holmes, Christine Lahti, Camille Mana, David Denman, Don Wadsworth, Robert Haley",United States,"July 12, 2019",2008,R,95 min,"Comedies, Dramas, Independent Movies",An unexpected romance and a surprise visit from his wild brother turn the life of widowed professor Lawrence Wetherhold upside down.
3028,70299904,Movie,The Battered Bastards of Baseball,"Chapman Way, Maclain Way","Todd Field, Kurt Russell",United States,"July 11, 2014",2014,NR,80 min,"Documentaries, Sports Movies","The colorful true story of the Portland Mavericks, a scrappy, independent baseball team of underdogs started by actor Bing Russell in the 1970s."
3031,80044731,Movie,Chris Tucker Live,Phil Joanou,Chris Tucker,United States,"July 10, 2015",2015,TV-MA,92 min,Stand-Up Comedy,"Filmed in his hometown of Atlanta, Chris Tucker showcases his stand-up comedic chops as he shares his experiences from childhood to the big time."
3032,60010069,Movie,Alice Doesn't Live Here Anymore,Martin Scorsese,"Ellen Burstyn, Kris Kristofferson, Billy Green Bush, Diane Ladd, Harvey Keitel, Lelia Goldoni, Lane Bradbury, Vic Tayback, Jodie Foster, Alfred Lutter",United States,"July 1, 2019",1974,PG,112 min,"Classic Movies, Comedies, Dramas","A widowed singer and single mother starts over as a diner waitress in Arizona, befriending her coworkers and romancing a ruggedly handsome rancher."
3035,70084148,Movie,Frozen River,Courtney Hunt,"Melissa Leo, Misty Upham, Charlie McDermott, Michael O'Keefe, Mark Boone Junior, James Reilly, Jay Klaitz, John Canoe, Dylan Carusona, Michael Sky",United States,"July 1, 2019",2008,R,97 min,"Dramas, Independent Movies","On a Mohawk reservation on the Canadian border, Ray Eddy teams with a widowed tribe member to smuggle illegal immigrants into the United States."
3038,80238020,Movie,Katherine Ryan: Glitter Room,Linda Mendoza,Katherine Ryan,United States,"July 1, 2019",2019,TV-MA,66 min,Stand-Up Comedy,"Fresh from a tour, comedian Katherine Ryan shares shrewd observations about school bullies, revenge bodies and raising a very fancy child."
3039,70128697,Movie,Kill the Irishman,Jonathan Hensleigh,"Ray Stevenson, Vincent D'Onofrio, Val Kilmer, Christopher Walken, Linda Cardellini, Fionnula Flanagan, Jason Butler Harner, Vinnie Jones, Paul Sorvino, Marcus Thomas, Tony Darrow, Jim Gaffigan, Jeremy Davies, Emma Roberts, Viola Davis, Lauren Graham, Zoë Kravitz, Aasif Mandvi, Keir Gilchrist",United States,"July 1, 2019",2011,R,106 min,"Action & Adventure, Dramas, Independent Movies","This true crime tale charts the rise and fall of mobster Danny Greene, who faced down the Mafia to gain control of organized crime in 1970s Cleveland."
3040,70044688,Movie,Lady in the Water,M. Night Shyamalan,"Paul Giamatti, Bryce Dallas Howard, Jeffrey Wright, Bob Balaban, Sarita Choudhury, Cindy Cheung, M. Night Shyamalan, Freddy Rodríguez, Bill Irwin, Mary Beth Hurt",United States,"July 1, 2019",2006,PG-13,110 min,"Sci-Fi & Fantasy, Thrillers","When an apartment building manager discovers a water nymph in the complex's swimming pool, he tries to help her return to her mythical home."
3041,60035622,Movie,Little Monsters,Richard Greenberg,"Fred Savage, Howie Mandel, Daniel Stern, Margaret Whitton, Rick Ducommun, Frank Whaley, Ben Savage, William Murray Weiss, Devin Ratray, Amber Barretto, J. Michael Hunter, Tom Hull",United States,"July 1, 2019",1989,PG,102 min,"Children & Family Movies, Comedies","Brian knows there are creatures under his bed. When he faces his fears and confronts them, however, he makes some hilariously weird new friends."
