,show_id,type,title,director,cast,country,date_added,release_year,rating,duration,listed_in,description
1322,81078466,Movie,Jeff Garlin: Our Man In Chicago,Christopher Storer,Jeff Garlin,United States,"November 12, 2019",2019,TV-MA,59 min,Stand-Up Comedy,"Comedian Jeff Garlin (unintentionally) celebrates his 37th year of stand-up and shares his learnings on love, loss, success and food addiction."
1323,80060034,Movie,Green Room,Jeremy Saulnier,"Anton Yelchin, Imogen Poots, Patrick Stewart, Alia Shawkat, Joe Cole, Callum Turner, Macon Blair, David W. Thompson, Mark Webber, Eric Edelstein, Kai Lennox",United States,"November 12, 2018",2015,R,95 min,"Horror Movies, Thrillers","At the end of their low-budget tour, a punk band accepts a gig at an isolated rural club, only to discover that their hosts are neo-Nazis."
1325,70117297,Movie,A Single Man,Tom Ford,"Colin Firth, Julianne Moore, Nicholas Hoult, Ginnifer Goodwin, Matthew Goode, Paul Butler, Ryan Simpkins, Teddy Sears, Paulette Lamori, Jon Kortajarena",United States,"November 11, 2019",2009,R,100 min,"Dramas, Independent Movies, LGBTQ Movies",This stream-of-consciousness drama centers on a day in the life of a gay college professor who's reeling from his longtime lover's recent death.
1327,81152923,Movie,Submission,J.M. Berrios,"Scott Pryor, Darrin Dewitt Henson, Eric Roberts, Kevin Sizemore, Lorynn York, John Gray, Sara McMann, Ovince Saint Preux",United States,"November 11, 2019",2019,TV-MA,95 min,"Action & Adventure, Dramas","After a near-death trip home, a Marine looking to help his comrade survive returns to the underground world of MMA, where new battles await."
1331,80091658,Movie,True Memoirs of an International Assassin,Jeff Wadlow,"Kevin James, Andy Garcia, Zulay Henao, Maurice Compte, Kelen Coleman, Andrew Howard, Rob Riggle, Leonard Earl Howze, Yul Vazquez, Kim Coates, Daniel Zacapa, Ron Rifkin, Jeff Chase",United States,"November 11, 2016",2016,TV-14,98 min,"Action & Adventure, Comedies","After his publisher markets his crime novel as a memoir, a novice author finds himself forcibly recruited into a deadly political plot in Venezuela."
1335,70174733,Movie,Bill Burr: Let It Go,Shannon Hartman,Bill Burr,United States,"November 10, 2017",2010,NR,65 min,Stand-Up Comedy,"The musings of comedian Bill Burr are let loose in this special, which was filmed at the historic Fillmore Auditorium in San Francisco."
1338,80198018,Movie,Natalia Valdebenito: Gritona,Natalia Valdebenito,Natalia Valdebenito,United States,"November 10, 2017",2017,TV-MA,76 min,Stand-Up Comedy,"Chile's Natalia Valdebenito hits Santiago's Teatro Caupolicán with a one-woman show steeped in irony, a dash of improv and her own personal style."
1341,80134279,Movie,Kathleen Madigan: Bothering Jesus,Lorene Machado,Kathleen Madigan,United States,"November 10, 2016",2016,TV-MA,71 min,Stand-Up Comedy,"The Irish American comic riffs on everything from growing up in Missouri, signing up her parents to be Uber drivers and anything to do with bacon."
1344,26597413,Movie,187,Kevin Reynolds,"Samuel L. Jackson, John Heard, Kelly Rowan, Clifton Collins Jr., Tony Plana",United States,"November 1, 2019",1997,R,119 min,Dramas,"After one of his high school students attacks him, dedicated teacher Trevor Garfield grows weary of the gang warfare in the New York City school system and moves to California to teach there, thinking it must be a less hostile environment."
1348,18002692,Movie,American History X,Tony Kaye,"Edward Norton, Edward Furlong, Beverly D'Angelo, Jennifer Lien, Ethan Suplee, Fairuza Balk, Avery Brooks, Elliott Gould, Stacy Keach, William Russ, Guy Torry",United States,"November 1, 2019",1998,R,119 min,Dramas,A neo-Nazi gets sent to prison for murder and comes out a changed man. But can he prevent his younger brother from following in his footsteps?
1349,81024100,Movie,American Son,Kenny Leon,"Kerry Washington, Steven Pasquale, Jeremy Jordan, Eugene Lee",United States,"November 1, 2019",2019,TV-MA,90 min,Dramas,Time passes and tension mounts in a Florida police station as an estranged interracial couple awaits news of their missing teenage son.
1350,60027583,Movie,Anger Management,Peter Segal,"Adam Sandler, Jack Nicholson, Marisa Tomei, Luis Guzmán, Allen Covert, Lynne Thigpen, Kurt Fuller, Jonathan Loughran, Krista Allen, January Jones, Woody Harrelson, John Turturro, Kevin Nealon",United States,"November 1, 2019",2003,PG-13,105 min,Comedies,"After a gentle businessman is forced to get anger management counseling, his therapist moves in – but turns out to have anger issues of his own."
1353,60002033,Movie,Butterfield 8,Daniel Mann,"Elizabeth Taylor, Laurence Harvey, Eddie Fisher, Dina Merrill, Mildred Dunnock, Betty Field, Jeffrey Lynn, Susan Oliver",United States,"November 1, 2019",1960,TV-14,108 min,"Classic Movies, Dramas, Romantic Movies","Elizabeth Taylor won an Oscar as Gloria Wandrous, a stylish call girl who yearns to go straight, especially after she thinks she's found Mr. Right."
1354,70046968,Movie,Cat on a Hot Tin Roof,Richard Brooks,"Elizabeth Taylor, Paul Newman, Burl Ives, Jack Carson, Judith Anderson, Madeleine Sherwood, Larry Gates, Vaughn Taylor",United States,"November 1, 2019",1958,NR,108 min,"Classic Movies, Dramas","Members of a Southern clan scramble to curry favor with a dying, wealthy patriarch in this adaptation of Tennessee Williams's sizzling stage drama."
1355,81154982,Movie,Christmas Break-In,Michael Kampa,"Danny Glover, Denise Richards, Cameron Seely, Sean O'Bryan, Katrina Begin, Jake Van Wagoner, Douglas Spain, Dawson Ehlke",United States,"November 1, 2019",2019,TV-PG,87 min,"Children & Family Movies, Comedies","Stranded at school before holiday break, a precocious girl gets into the spirit of saving when a trio of robbers trespass and hold the janitor hostage."
1356,81063129,Movie,Christmas in the Heartland,Harvey Lowry,"Sierra McCormick, Brighton Sharbino, Bo Derek, Shelley Long, Christopher Rich, JoeDon Rooney, Tiffany Fallon, Paula Trickey, Christian Kane",United States,"November 1, 2019",2017,TV-PG,112 min,Dramas,Two girls realize they're both visiting grandparents they’ve never met and decide to switch places to see how the other half lives.
1358,382650,Movie,Cleopatra Jones,Jack Starrett,"Tamara Dobson, Bernie Casey, BrendaSykes, Esther Rolle, Shelley Winters",United States,"November 1, 2019",1973,PG,89 min,"Action & Adventure, Classic Movies","A stylin' special agent chases down drug lords and does her part to stop trafficking. Soon, she finds herself seeking revenge on a dealer."
1359,70044705,Movie,Code Name: The Cleaner,Les Mayfield,"Cedric the Entertainer, Lucy Liu, Nicollette Sheridan, Mark Dacascos, Callum Keith Rennie, DeRay Davis, Niecy Nash, Will Patton",United States,"November 1, 2019",2007,PG-13,91 min,"Action & Adventure, Comedies",A mild-mannered janitor duped into believing he's an undercover agent stumbles into an international arms ring plot involving the CIA and the FBI.
1365,485218,Movie,Executive Decision,Stuart Baird,"Kurt Russell, Halle Berry, John Leguizamo, Oliver Platt, Steven Seagal, Joe Morton, David Suchet, BD Wong, Len Cariou, Whip Hubley",United States,"November 1, 2019",1996,R,133 min,Action & Adventure,"When terrorists hijack a 747 and turn it into a nerve gas bomb aimed at Washington, D.C., commandos use an experimental plane to try to stop them."
1366,1192866,Movie,Fallen,Gregory Hoblit,"Denzel Washington, John Goodman, Donald Sutherland, Embeth Davidtz, James Gandolfini, Elias Koteas, Gabriel Casseus, Michael J. Pagan, Robert Joy",United States,"November 1, 2019",1998,R,124 min,Thrillers,A tough homicide cop faces his most dangerous assignment when he must stop a murderous evil spirit who can move from one host to the next.
1367,11819434,Movie,Fear and Loathing in Las Vegas,Terry Gilliam,"Johnny Depp, Benicio Del Toro, Tobey Maguire, Ellen Barkin, Gary Busey, Christina Ricci, Mark Harmon, Cameron Diaz, Katherine Helmond, Michael Jeter, Craig Bierko, Lyle Lovett, Flea, Christopher Meloni, Harry Dean Stanton, Tim Thomerson",United States,"November 1, 2019",1998,R,118 min,"Comedies, Cult Movies, Dramas",A sportswriter and his Samoan lawyer embark on a hallucinogenic three-day romp from Los Angeles to Las Vegas in this counterculture cult favorite.
1369,516788,Movie,Forbidden Planet,Fred M. Wilcox,"Leslie Nielsen, Walter Pidgeon, Anne Francis, Jack Kelly, Warren Stevens, James Drury, Earl Holliman",United States,"November 1, 2019",1956,G,98 min,"Action & Adventure, Classic Movies, Sci-Fi & Fantasy","A pulp-fiction sci-fi classic, Forbidden Planet stars Leslie Nielsen as a heroic starship captain who finds the paradise planet Altair-IV."
1370,70048968,Movie,Getting Played,David Silberg,"Carmen Electra, Stacey Dash, Vivica A. Fox, Bill Bellamy, Kathy Najimy, Joe Torry, Dorian Gregory, Mindy Sterling, Joseph C. Phillips, Larry B. Scott, Michael Jai White, Sheryl Underwood, Earthquake",United States,"November 1, 2019",2005,PG-13,85 min,"Comedies, Romantic Movies","Tired of dealing with boyfriends who wrong them, gal pals Lauren, Emily and Andrea decide to turn the tables and become the players themselves."
1371,542137,Movie,Gigi,"Vincente Minnelli, Charles Walters","Leslie Caron, Maurice Chevalier, Louis Jourdan, Hermione Gingold, Eva Gabor, Jacques Bergerac, Isabel Jeans, John Abbott, Edwin Jerome, Corinne Marchand",United States,"November 1, 2019",1958,G,115 min,"Classic Movies, Comedies, Music & Musicals",Gigi's an avant-garde French waif being groomed as the fille de joie of affluent and handsome Gaston. Soon Gigi metamorphoses into a stunning beauty.
1374,60000577,Movie,Grease,Randal Kleiser,"John Travolta, Olivia Newton-John, Stockard Channing, Jeff Conaway, Barry Pearl, Michael Tucci, Kelly Ward, Didi Conn, Jamie Donnelly, Dinah Manoff, Eve Arden, Dody Goodman, Sid Caesar, Joan Blondell, Frankie Avalon",United States,"November 1, 2019",1978,PG,110 min,"Classic Movies, Comedies, Music & Musicals",John Travolta and Olivia Newton-John star in this hit musical comedy about a greaser and the good girl he falls for – much to his friends' chagrin.
1379,81083786,Movie,Holly Star,Michael A. Nickles,"Katlyn Carlson, Brian Muller, Teya Patt, Pamela Chabora",United States,"November 1, 2019",2018,PG,92 min,"Children & Family Movies, Comedies, Romantic Movies","Home for the holidays, a broke puppeteer knows there’s treasure buried somewhere under her town. To find it, all she has to do is die – almost."
1381,1179333,Movie,How to Be a Player,Lionel C. Martin,"Bill Bellamy, Natalie Desselle, Lark Voorhies, Mari Morrow, Pierre Edwards, Jermaine 'Huggy' Hopkins, Anthony Johnson, Max Julien, Beverly Johnson, Gilbert Gottfried, Bernie Mac",United States,"November 1, 2019",1997,R,94 min,Comedies,"Dray lives life one woman at a time and is the envy of all his friends, until his sister decides to show him the error of his philandering ways."
1382,70118779,Movie,Invictus,Clint Eastwood,"Morgan Freeman, Matt Damon, Tony Kgoroge, Patrick Mofokeng, Matt Stern, Julian Lewis Jones, Adjoa Andoh, Marguerite Wheatley, Leleti Khumalo, Patrick Lyster, Penny Downie",United States,"November 1, 2019",2009,PG-13,134 min,"Dramas, Sports Movies","After the end of apartheid, newly elected President Nelson Mandela uses the 1995 World Cup rugby matches to unite his people in South Africa."
1383,653673,Movie,Jimi Hendrix,Joe Boyd,"Jimi Hendrix, Eric Clapton, Billy Cox",United States,"November 1, 2019",1973,R,102 min,"Documentaries, Music & Musicals","Jimi Hendrix's family, friends, and fellow musicians discuss his life and influence. Hendrix also appears in classic performance footage."
1385,70117305,Movie,Legion,Scott Stewart,"Paul Bettany, Lucas Black, Tyrese Gibson, Adrianne Palicki, Charles S. Dutton, Jon Tenney, Kevin Durand, Willa Holland, Kate Walsh, Dennis Quaid, Jeanette Miller, Cameron Harlow, Doug Jones, Josh Stamberg, Yancey Arias",United States,"November 1, 2019",2010,R,100 min,"Action & Adventure, Horror Movies, Sci-Fi & Fantasy",A motley crew of apocalypse survivors living at an abandoned truck stop never suspects that the pregnant woman among them is carrying the Messiah.
1388,709163,Movie,Logan's Run,Michael Anderson,"Michael York, Richard Jordan, Farrah Fawcett, Jenny Agutter, Peter Ustinov, Roscoe Lee Browne, Randolph Roberts, Gary Morgan, Greg Lewis",United States,"November 1, 2019",1976,PG,118 min,"Action & Adventure, Classic Movies, Cult Movies","In the 23rd century, inhabitants of a domed city exist in a world filled with life's pleasures – but no one is allowed to live past the age of 30."
1390,1150871,Movie,Love Jones,Theodore Witcher,"Larenz Tate, Nia Long, Isaiah Washington, Lisa Nicole Carson, Bill Bellamy, Leonard Roberts, Bernadette L. Clarke, Khalil Kain",United States,"November 1, 2019",1997,R,109 min,"Comedies, Dramas, Independent Movies","In this urban romantic comedy set in Chicago, the ups and downs of courtship play out between a young black poet and a pretty shutterbug."
1391,70082264,Movie,Mad Money,"Callie Khouri, Jesse V. Johnson","Diane Keaton, Queen Latifah, Katie Holmes, Ted Danson, Roger Cross, Adam Rothenberg, Stephen Root, Christopher McDonald, Meagen Fay, J.C. MacKenzie, Finesse Mitchell, Eric Keenleyside",United States,"November 1, 2019",2008,PG-13,99 min,Comedies,A woman joins the janitorial staff of the Federal Reserve Bank and conspires with two co-workers to pilfer old money that's scheduled to be destroyed.
1393,1179583,Movie,Money Talks,Brett Ratner,"Charlie Sheen, Chris Tucker, Heather Locklear, Paul Sorvino, Gérard Ismaël, Damian Chapa, Elise Neal, Michael Wright, Veronica Cartwright",United States,"November 1, 2019",1997,R,96 min,"Action & Adventure, Comedies","TV news reporter James Russell helps put small-time criminal Franklin Hatchett in jail, but turns to protecting Hatchett when he escapes from prison."
1394,70044595,Movie,Monster House,Gil Kenan,"Mitchel Musso, Sam Lerner, Spencer Locke, Steve Buscemi, Kathleen Turner, Jason Lee, Jon Heder, Maggie Gyllenhaal, Catherine O'Hara, Fred Willard, Nick Cannon, Kevin James",United States,"November 1, 2019",2006,PG,91 min,"Children & Family Movies, Comedies",Three friends uncover the truth about a scary abandoned house in their neighborhood that has a personality of its own and seems to be eating people.
1395,60011729,Movie,Mutiny on the Bounty,"Lewis Milestone, Carol Reed","Marlon Brando, Trevor Howard, Richard Harris, Hugh Griffith, Richard Haydn, Tarita",United States,"November 1, 2019",1962,TV-PG,185 min,"Action & Adventure, Classic Movies, Dramas","Marlon Brando gives a nuanced performance as the aristocratic Lt. Fletcher Christian, an officer aboard the HMS Bounty who leads a mutiny against the ship's tyrannical Capt. Bligh."
1398,60021590,Movie,Ocean's Eleven,Lewis Milestone,"Frank Sinatra, Dean Martin, Sammy Davis Jr., Peter Lawford, Angie Dickinson, Richard Conte, Cesar Romero, Patrice Wymore, Joey Bishop",United States,"November 1, 2019",1960,TV-PG,127 min,"Action & Adventure, Classic Movies, Comedies","Frank Sinatra leads an all-star cast as Danny Ocean, who decides to knock over a few casinos on the Las Vegas Strip with his buddies."
1399,60023638,Movie,Paid in Full,Charles Stone III,"Wood Harris, Mekhi Phifer, Kevin Carroll, Esai Morales, Chi McBride, Cam'ron, Remo Greene, Cynthia Martells, Elise Neal, Regina Hall, Joyce Walker",United States,"November 1, 2019",2002,R,98 min,"Action & Adventure, Dramas",This fictionalized account of three real-life notorious Harlem drug dealers is told in flashbacks as they plunge into the world of hustling.
1401,70031792,Movie,Rebel Without a Cause,Nicholas Ray,"James Dean, Natalie Wood, Sal Mineo, Jim Backus, Ann Doran, Corey Allen, William Hopper, Rochelle Hudson, Dennis Hopper, Edward Platt",United States,"November 1, 2019",1955,PG-13,111 min,"Classic Movies, Dramas","When Jim Stark arrives in a new town with his troubled past firmly in tow, he quickly falls for the girl next door and befriends the vulnerable Plato."
1403,60002403,Movie,Rosemary's Baby,Roman Polanski,"Mia Farrow, John Cassavetes, Ruth Gordon, Sidney Blackmer, Maurice Evans, Ralph Bellamy, Patsy Kelly, Elisha Cook Jr., Emmaline Henry, Charles Grodin",United States,"November 1, 2019",1968,R,137 min,"Classic Movies, Horror Movies, Thrillers","A woman is thrilled to find out she's pregnant. But as her belly grows, the more certain she becomes that her unborn child is in serious danger."
1404,17236920,Movie,Rounders,John Dahl,"Matt Damon, Edward Norton, John Turturro, Gretchen Mol, Famke Janssen, John Malkovich, Martin Landau, Michael Rispoli, Josh Mostel, Tom Aldredge",United States,"November 1, 2019",1998,R,121 min,Dramas,"A law student befriends and ""befoes"" a fellow gambling addict and a club owner, and tensions run high when they must come up with $15k in just 5 days."
1406,81152930,Movie,Santa Girl,Blayne Weaver,"Barry Bostwick, Jennifer Stone, Devon Werkheiser, McKayla Witt, Joshua Cody, Hank Stone",United States,"November 1, 2019",2019,TV-PG,91 min,"Children & Family Movies, Comedies, Romantic Movies","Fleeing the family business and an arranged marriage, Santa’s daughter chooses a magical adventure of her own: College."
1407,973861,Movie,Sling Blade,Billy Bob Thornton,"Billy Bob Thornton, Dwight Yoakam, J.T. Walsh, John Ritter, Lucas Black, Natalie Canerday, James Hampton, Robert Duvall, Rick Dial, Brent Briscoe",United States,"November 1, 2019",1996,R,135 min,"Dramas, Independent Movies","A man returns home after being released from a psychiatric hospital, where he'd been confined since age 12 for murdering his mother and her lover."
1408,70058796,Movie,Sparkle,Sam O'Steen,"Tony King, Mary Alice, Irene Cara, Dorian Harewood, Paul Lambert, Beatrice Winde, Lonette McKee",United States,"November 1, 2019",1976,PG,98 min,"Dramas, Music & Musicals","In 1950s Harlem, three singing sisters hit the big time and end up losing one another in this musical melodrama inspired by the Supremes."
1409,70047101,Movie,Spider-Man 3,Sam Raimi,"Tobey Maguire, Kirsten Dunst, James Franco, Thomas Haden Church, Topher Grace, Bryce Dallas Howard, Rosemary Harris, J.K. Simmons, James Cromwell, Theresa Russell, Dylan Baker, Bill Nunn, Bruce Campbell, Elizabeth Banks",United States,"November 1, 2019",2007,PG-13,139 min,"Action & Adventure, Sci-Fi & Fantasy",The seemingly invincible Spider-Man goes up against an all-new crop of villains in the third installment of the blockbuster adventure series.
1411,70093991,Movie,Step Brothers,Adam McKay,"Will Ferrell, John C. Reilly, Mary Steenburgen, Richard Jenkins, Adam Scott, Kathryn Hahn, Andrea Savage, Lurie Poston, Elizabeth Yozamp, Logan Manus, Rob Riggle",United States,"November 1, 2019",2008,R,98 min,Comedies,"Brennan and Dale might be grown men, but that doesn't stop a childish sibling rivalry from erupting after Brennan's mom marries Dale's dad."
1412,60033247,Movie,Superfly,Gordon Parks,"Ron O'Neal, Carl Lee, Sheila Frazier, Julius Harris, Charles McGregor, Nate Adams, Polly Niles, Yvonne Delaine",United States,"November 1, 2019",1972,R,91 min,"Action & Adventure, Classic Movies, Dramas","To get away from the thug life, cocaine dealer Youngblood Priest puts together one last deal that will net him enough money to start over."
1413,70060000,Movie,The Brave One,Neil Jordan,"Jodie Foster, Terrence Howard, Naveen Andrews, Carmen Ejogo, Nicky Katt, Mary Steenburgen, Lenny Venito, Zoë Kravitz, Jane Adams, Gordon MacDonald",United States,"November 1, 2019",2007,R,122 min,"Dramas, Thrillers",New York City radio host Erica Bain decides to take the law into her own hands after losing her fiancé in a brutal Central Park attack.
1415,70031779,Movie,The Cincinnati Kid,Norman Jewison,"Steve McQueen, Edward G. Robinson, Ann-Margret, Karl Malden, Tuesday Weld, Joan Blondell, Rip Torn, Jack Weston, Cab Calloway, Jeff Corey, Theo Marcuse",United States,"November 1, 2019",1965,TV-14,103 min,"Classic Movies, Dramas","In Depression-era New Orleans, cocksure stud poker player Eric Stoner – the titular Cincinnati Kid – challenges longtime champ Lancey ""The Man"" Howard to a showdown at the table, where a war of wills – and nerve – ensues."
1416,1178866,Movie,The Game,David Fincher,"Michael Douglas, Sean Penn, Deborah Kara Unger, James Rebhorn, Peter Donat, Carroll Baker, Anna Katarina, Armin Mueller-Stahl",United States,"November 1, 2019",1997,R,129 min,Thrillers,"Nicholas receives an unusual birthday present from his brother, Conrad – a gift certificate to play a unique kind of game formulated by ""CRS."""
1420,684847,Movie,The Last Boy Scout,Tony Scott,"Bruce Willis, Damon Wayans, Chelsea Field, Noble Willingham, Taylor Negron, Danielle Harris, Halle Berry, Bruce McGill",United States,"November 1, 2019",1991,R,105 min,"Action & Adventure, Comedies",Private eye Joe Hallenbeck is forced to team up with a disgraced quarterback to uncover a conspiracy by a politician and a football team owner.
1422,20557937,Movie,The Matrix,"Lilly Wachowski, Lana Wachowski","Keanu Reeves, Laurence Fishburne, Carrie-Anne Moss, Hugo Weaving, Gloria Foster, Joe Pantoliano, Marcus Chong, Julian Arahanga, Matt Doran, Belinda McClory",United States,"November 1, 2019",1999,R,136 min,"Action & Adventure, Sci-Fi & Fantasy","A computer hacker learns that what most people perceive as reality is actually a simulation created by machines, and joins a rebellion to break free."
1423,60027695,Movie,The Matrix Reloaded,"Lilly Wachowski, Lana Wachowski","Keanu Reeves, Laurence Fishburne, Carrie-Anne Moss, Hugo Weaving, Jada Pinkett Smith, Gloria Foster, Harold Perrineau, Monica Bellucci, Harry Lennix, Lambert Wilson, Randall Duk Kim, Nona Gaye",United States,"November 1, 2019",2003,R,138 min,"Action & Adventure, Sci-Fi & Fantasy","The crew must protect Zion, the last outpost still under human control, after it is pinpointed by the machines responsible for the Matrix."
1424,60031303,Movie,The Matrix Revolutions,"Lilly Wachowski, Lana Wachowski","Keanu Reeves, Laurence Fishburne, Carrie-Anne Moss, Hugo Weaving, Jada Pinkett Smith, Mary Alice, Harold Perrineau, Monica Bellucci, Harry Lennix, Lambert Wilson, Nona Gaye",United States,"November 1, 2019",2003,R,129 min,"Action & Adventure, Sci-Fi & Fantasy",The final installment in the Matrix trilogy finds an unconscious Neo trapped in a subway station in a zone between the Matrix and the machine world.
1426,848915,Movie,The Pelican Brief,Alan J. Pakula,"Julia Roberts, Denzel Washington, Sam Shepard, John Heard, Tony Goldwyn, James Sikking, William Atherton, Robert Culp, Stanley Tucci, John Lithgow, Hume Cronyn",United States,"November 1, 2019",1993,PG-13,141 min,"Dramas, Thrillers","When law student Darby Shaw theorizes about the assassinations of two Supreme Court justices, she is put in danger and turns to a reporter for help."
1427,60022980,Movie,The Tuxedo,Kevin Donovan,"Jackie Chan, Jennifer Love Hewitt, Jason Isaacs, Debi Mazar, Ritchie Coster, Peter Stormare, Mia Cottet, Romany Malco, Daniel Kash",United States,"November 1, 2019",2002,PG-13,99 min,"Action & Adventure, Comedies","After a government spy is hospitalized, New York City cab driver Jimmy unwillingly takes over the spy's role – with the aid of a computerized tuxedo."
1428,60003961,Movie,"Thelonious Monk: Straight, No Chaser",Charlotte Zwerin,"Thelonious Monk, Samuel E. Wright",United States,"November 1, 2019",1988,PG-13,89 min,"Documentaries, Music & Musicals",The spotlight shines on iconic jazz pianist and composer Thelonious Monk in this 1988 documentary featuring vintage performance clips and interviews.
1430,70060005,Movie,Vantage Point,Pete Travis,"Dennis Quaid, Matthew Fox, Forest Whitaker, Bruce McGill, Edgar Ramírez, Saïd Taghmaoui, Ayelet Zurer, Zoe Saldana, Sigourney Weaver, William Hurt",United States,"November 1, 2019",2008,PG-13,90 min,Action & Adventure,"Moments after he arrives in Spain for an antiterrorism summit, U.S. President Ashton is shot."
1435,70123542,Movie,Zombieland,Ruben Fleischer,"Jesse Eisenberg, Woody Harrelson, Emma Stone, Abigail Breslin, Amber Heard, Bill Murray, Derek Graf",United States,"November 1, 2019",2009,R,88 min,"Comedies, Horror Movies","Looking to survive in a world taken over by zombies, a dorky college student teams with an urban roughneck and a pair of grifter sisters."
1444,16914787,Movie,BASEketball,David Zucker,"Trey Parker, Matt Stone, Dian Bachar, Yasmine Bleeth, Jenny McCarthy, Ernest Borgnine, Robert Vaughn, Trevor Einhorn",United States,"November 1, 2018",1998,R,103 min,"Comedies, Sports Movies","When two slackers' made-up sport, BASEketball, becomes a national craze, they hope to cash in on the basketball/baseball hybrid's popularity."
1455,80232501,Movie,Edge of Fear,Bobby Roth,"Shen Lin, Robert Patrick, Zhu Zhu, Jodi Lyn O'Keefe, Robert Knepper, Amaury Nolasco, Rockmond Dunbar, Andy Mackenzie, Robert Crayton, John Edward Lee, Trent Brya",United States,"November 1, 2018",2018,TV-MA,92 min,"Independent Movies, Thrillers","During a wilderness getaway, a gang of sociopathic criminals kidnap a woman and assault her husband, who must summon all his strength to save her."
1457,80224606,Movie,Filmworker,Tony Zierra,Leon Vitali,United States,"November 1, 2018",2017,TV-MA,94 min,Documentaries,Leon Vitali had a thriving acting career most others would envy. Then he gave it all up to devote himself completely to the vision of Stanley Kubrick.
1470,70056663,Movie,Katt Williams: The Pimp Chronicles: Pt. 1,Gary Binkow,"Katt Williams, Anthony Anderson",United States,"November 1, 2018",2006,TV-MA,45 min,Stand-Up Comedy,"In this 2006 show, comic Katt Williams uses his edgy style and personal experiences to paint a sassy, hilarious portrait of life in black America."
