,show_id,type,title,director,cast,country,date_added,release_year,rating,duration,listed_in,description
3880,70166234,Movie,Being Elmo: A Puppeteer's Journey,Constance Marks,"Kevin Clash, Whoopi Goldberg",United States,"February 21, 2012",2011,PG,76 min,Documentaries,"Whoopi Goldberg narrates Elmo creator Kevin Clash's remarkable journey from a working-class Baltimore neighborhood to Jim Henson's ""Sesame Street."""
3881,60031404,Movie,Kevin James: Sweat the Small Stuff,Paul Miller,Kevin James,United States,"February 20, 2019",2001,TV-PG,42 min,Stand-Up Comedy,The film and television star riffs on life's many royal pains in this hourlong special taped at New York City's Hudson Theatre in 2001.
3886,81060040,Movie,All Light Will End,Chris Blake,"Ashley Pereira, Alexandra Harris, Ted Welch, Sam Jones III, Sarah Butler, Andy Buckley, Graham Outerbridge, Michael James Thomas, John Schuck, Aaron Munoz",United States,"February 2, 2019",2018,TV-MA,84 min,"Horror Movies, Thrillers","A horror novelist with a traumatic past returns to her childhood hometown, where she revisits her night terrors and loses sight of reality."
3896,80098490,Movie,Trash Fire,Richard Bates Jr.,"Adrian Grenier, Angela Trimbur, AnnaLynne McCord, Fionnula Flanagan, Matthew Gray Gubler, Ray Santiago, Sally Kirkland, Ezra Buzzington",United States,"February 2, 2017",2016,R,94 min,"Comedies, Dramas, Independent Movies",Surprise news that his girlfriend is pregnant sends loutish Owen on an ill-advised trip to reconnect with his twisted sister and sadistic grandmother.
3898,70176656,Movie,Spy Kids: All the Time in the World,Robert Rodriguez,"Jessica Alba, Joel McHale, Rowan Blanchard, Mason Cook, Jeremy Piven, Alexa PenaVega, Daryl Sabara, Ricky Gervais, Danny Trejo",United States,"February 19, 2019",2011,PG,88 min,"Children & Family Movies, Comedies",Former Spy Kids Carmen and Juni return to help twin siblings Rebecca and Cecil Wilson save the world with their retired secret-agent stepmother.
3901,80214581,Movie,Dismissed,Benjamin Arfmann,"Kent Osborne, Dylan Sprouse, Rae Gray, Alycia Delmore, Robert Longstreet, Chris Bauer, Randall Park, Mitchell Edwards, Victoria Zeutzius, Leslie Thurston, Matthew J. Evans",United States,"February 19, 2018",2017,TV-14,87 min,Thrillers,An intelligent but intense honor student traumatizes his high school teacher and mentor when he doesn't get the grade he believes he deserves.
3906,80158772,Movie,Growing Up Wild,Keith Scholey,Daveed Diggs,United States,"February 19, 2017",2016,G,78 min,"Children & Family Movies, Documentaries","Five baby animals from different parts of the world grow up learning to survive in the wild, nurtured by the love and guidance of their families."
3910,70307570,Movie,Abominable Christmas,Chad Van De Keere,"Isabella Acres, Drake Bell, Emilio Estevez, Nolan Gould, Matthew Lillard, Ray Liotta, Jane Lynch, Ariel Winter",United States,"February 18, 2016",2012,TV-Y7,44 min,"Children & Family Movies, Comedies",Two small abominable snowmen flee their mountain to escape a scientist who's trying to capture them and end up spending Christmas with a human family.
3911,80081337,Movie,Dear Dracula,Chad Van De Keere,"Nathan Gamble, Ray Liotta, Emilio Estevez, Ariel Winter, Matthew Lillard, Yuri Lowenthal, Marion Ross, Tara Strong",United States,"February 18, 2016",2012,TV-Y7-FV,43 min,"Children & Family Movies, Comedies","When he gets a fan letter from a young monster movie buff, Dracula visits him and soon has a new friend helping him to get his confidence back."
3914,80209153,Movie,Blood Money,Lucky McKee,"John Cusack, Ellar Coltrane, Willa Fitzgerald, Jacob Artist, Ned Bellamy, Antonio Bell, Johanna McGinley",United States,"February 17, 2018",2017,R,85 min,Action & Adventure,Three friends on a wilderness trip find bags full of cash and must evade the criminal who hid the money in the first place.
3917,80107808,Movie,Kill Ratio,Paul Tanter,"Tom Hopper, Amy Huberman, Lacy Moore, Brian McGuinness, Luke Pierucci, Nick Dunning",United States,"February 17, 2017",2016,TV-MA,87 min,Action & Adventure,"Posing as a telecom salesman at a business conference, a CIA agent fights to protect a fledgling Eastern European democracy from a military coup."
3924,80989337,Movie,The Super,Stephan Rick,"Patrick John Flueger, Val Kilmer, Louisa Krause, Mattea Conforti, Taylor Richardson, Paul Ben-Victor, Yul Vazquez, Andrea Lynn Green, Travaris Spears, Melissa Bolona",United States,"February 16, 2019",2017,R,89 min,Horror Movies,"When an ex-cop becomes a superintendent of an apartment building, he suspects the sinister janitor is behind the eerie disappearances of its tenants."
3927,80184625,Movie,Irreplaceable You,Stephanie Laing,"Gugu Mbatha-Raw, Michiel Huisman, Christopher Walken, Steve Coogan, Kate McKinnon, Jacki Weaver, Timothy Simons, Brian Tyree Henry, Alanna Masterson, Gayle Rankin, Tamara Tunie",United States,"February 16, 2018",2018,TV-MA,96 min,"Dramas, Romantic Movies","A stunning cancer diagnosis spurs Abbie to seek a future girlfriend for fiancé and childhood sweetheart Sam, who's clueless when it comes to dating."
3929,70100084,Movie,Milk,Gus Van Sant,"Sean Penn, Emile Hirsch, Josh Brolin, Diego Luna, James Franco, Alison Pill, Victor Garber, Denis O'Hare, Joseph Cross, Stephen Spinella, Lucas Grabeel, Brandon Boyce",United States,"February 16, 2017",2008,R,128 min,"Dramas, Independent Movies, LGBTQ Movies","Sean Penn stars in this biopic about Harvey Milk, the openly gay San Francisco politician who was murdered by a disgruntled city supervisor in 1978."
3930,80106438,Movie,Operator,Logan Kibens,"Martin Starr, Mae Whitman, Nat Faxon, Cameron Esposito, Retta, Christine Lahti, Kate Cobb, Kristopher Lofton, Tim Hopper, Trevor Dawkins",United States,"February 16, 2017",2016,TV-MA,91 min,"Comedies, Dramas, Independent Movies","When a programmer uses his wife's sympathetic voice for his company's customer service app, he starts to rely more on her idealized self than her."
3931,70295085,Movie,Marvel's Iron Man & Hulk: Heroes United,"Leo Riley, Eric Radomski","Adrian Pasdar, Fred Tatasciore, Dee Bradley Baker, Robin Atkin Downes, David Kaye",United States,"February 16, 2014",2013,PG,72 min,"Action & Adventure, Sci-Fi & Fantasy","When scientists join Hulk's gamma energy with Tony Stark's Arc Reactor, the resulting force creates a foe that only the two Marvel heroes can combat."
3941,81050193,Movie,Deadly Scholars,Danny J. Boyle,"Kennedy Lea Slocum, Corey Fogelmanis, Alexa Mansour, Peyton Clark, Sheryl Lee, Sherri Saum, Eric Stanton Betts, Paris Berelc, Pedro Correa, Alissa Latow",United States,"February 15, 2019",2018,TV-14,86 min,"Dramas, Thrillers","After a series of strange deaths, a high school reporter tries to pin down the killer who's targeting students eligible for a prestigious scholarship."
3947,80216820,Movie,Never Heard,Josh Webber,"Romeo Miller, David Banner, Robin Givens, Karrueche Tran, Dijon Talton, Dorien Wilson, Karen Abercrombie, Kandi Burruss, Brian White, Jackie Long",United States,"February 15, 2019",2018,TV-14,89 min,"Dramas, Faith & Spirituality","As his father sits behind bars, a young man is lured into Los Angeles' merciless drug world and forced to choose between God and gang life."
3953,81050194,Movie,The Detained,Blair Hayes,"Alex Frnka, Sarah Davenport, Henry Zaga, Coy Stewart, Jennifer Robyn Jacobs, Gillian Vigman, Kevin Blake",United States,"February 15, 2019",2017,TV-MA,85 min,"Horror Movies, Thrillers",Five high school students serving Saturday detention in a former corrections facility must find a way to outsmart an unseen menace out to kill them.
3973,80065214,Movie,"Aram, Aram",Christopher Chambers,"John Roohinian, Levon Sharafyan, Sevak Hakoyan, David Villada, Mike Ghader, Razmik Mansuryan, Lorita Meg, Amy Sanders, Alla Tumanian",United States,"February 15, 2017",2015,TV-14,79 min,"Dramas, Independent Movies","Newly orphaned Aram leaves Beirut to live with his grandfather in Los Angeles, and overwhelmed by culture shock, he falls prey to an Armenian gang."
3982,81071972,Movie,Grass,Tanuj Chopra,"Emily Chang, Pia Shah, Anthony Ma",United States,"February 14, 2019",2017,TV-MA,57 min,"Comedies, Independent Movies",Good girl Cam recruits her pot-loving bestie Jinky to help deliver a backpack full of weed for her drug-dealing fiancé.
3983,80244853,Movie,"Ken Jeong: You Complete Me, Ho",Jon M. Chu,Ken Jeong,United States,"February 14, 2019",2019,TV-MA,62 min,Stand-Up Comedy,"In his first-ever stand-up special, Ken Jeong pays tribute to his wife and shares stories about Hollywood and how ""The Hangover"" saved his life."
3984,80167498,Movie,Chris Rock: Tamborine,Bo Burnham,Chris Rock,United States,"February 14, 2018",2018,TV-MA,65 min,Stand-Up Comedy,"Chris Rock takes the stage in Brooklyn for a comedy special filled with searing observations on fatherhood, infidelity and American politics."
3987,80081987,Movie,Girlfriend's Day,Michael Paul Stephenson,"Bob Odenkirk, Amber Tamblyn, Natasha Lyonne, Alex Karpovsky, Stacy Keach, Andy Richter, Ed Begley Jr., David Sullivan, Larry Fessenden, June Diane Raphael, Rich Sommer, Steven Michael Quezada, Echo Kellum, Stephanie Courtney, Toby Huss, Tucker Smallwood, Kevin O'Grady, Nate Mooney",United States,"February 14, 2017",2017,TV-MA,71 min,"Comedies, Independent Movies","When he's caught up in a deadly conspiracy, an unemployed greeting card writer must create the perfect card for a new holiday to save his skin."
3991,80046696,Movie,Sister Code,Corey Grant,"Drew Sidora, Eva Marcille, Amber Rose, Marcus T. Paulk, Erica Ash, Essence Atkins, Amin Joseph, Rolonda Watts, Brooklyn McLinn, Don Hale Jr., Duane Martin, Anne-Marie Johnson",United States,"February 14, 2016",2015,R,95 min,"Comedies, Dramas, Romantic Movies","After the death of their beloved mother, three foster sisters find their bond tested by old grudges, career tensions and a startling revelation."
3998,80241304,Movie,We the Animals,Jeremiah Zagar,"Evan Rosado, Josiah Gabriel, Isaiah Kristian, Raúl Castillo, Sheila Vand, Giovanni Pacciarelli, Terry Holland, Moe Isaac, Mickey Anthony, Tom Malley",United States,"February 11, 2019",2018,R,93 min,"Dramas, Independent Movies","A trio of brothers cope with their parents' volatile relationship by running wild and unchecked, and one of them experiences a visceral awakening."
4004,80174429,TV Show,Metallica: Some Kind of Monster,"Joe Berlinger, Bruce Sinofsky","James Hetfield, Lars Ulrich, Kirk Hammett, Robert Trujillo",United States,"February 10, 2017",2014,TV-MA,1 Season,TV Shows,"This collection includes the acclaimed rock documentary about Metallica, plus a film checking in with the still-thriving group 10 years later."
4018,80220013,Movie,Heal,Kelly Noonan,"Kelly Noonan, Deepak Chopra, Michael Beckwith, Joe Dispenza, Dr. Jeffrey Thompson, Gregg Braden, Joan Borysenko, Marianne Williamson",United States,"February 1, 2019",2017,TV-PG,107 min,Documentaries,"Stories from spiritual leaders, physicians and those with chronic illnesses reveal the powerful connection between the human psyche and physical health."
4020,80065492,Movie,Lego DC Comics: Batman Be-Leaguered,Rick Morales,"Dee Bradley Baker, Troy Baker, John DiMaggio, Grey DeLisle, Tom Kenny, Nolan North, Khary Payton, James Arnold Taylor",United States,"February 1, 2019",2014,TV-Y7,22 min,Movies,"When Superman and the other Justice League superheroes start disappearing, it's up to Batman to unravel the caper and save the day."
4022,81048914,Movie,LEGO Marvel Super Heroes: Black Panther,Michael D. Black,"James Mathis III, Keston John, Yvette Nicole Brown, Daisy Lightfoot, Isaac C. Singleton Jr., Trevor Devall, Liam O'Brien, Mick Wingert, Fred Tatasciore, Laura Bailey",United States,"February 1, 2019",2018,TV-Y7-FV,22 min,Children & Family Movies,"When Thanos joins forces with villains Killmonger and Klaue to destroy Earth, Black Panther rushes to stop them from stealing Wakanda's vibranium."
4026,80220228,Movie,Malicious,Michael Winnick,"Bojana Novakovic, Josh Stewart, Delroy Lindo, Melissa Bolona, Yvette Yates, Luke Edwards, Jaqueline Fleming, Ben VanderMey, Presley Richardson, Joy Kate Lawson",United States,"February 1, 2019",2018,TV-MA,91 min,Horror Movies,"After receiving a strange present, a professor and his pregnant wife are plagued by tragedy and a paranormal presence that's determined to kill."
4039,80208661,Movie,The Witch Files,Kyle Rankin,"Holly Taylor, Alice Ziolkoski, Britt Flatmo, Paget Brewster, Tara Robinson, Adrienne Rose White, Greg Finley, Valerie Mahaffey, Jared Boghosian, William Bornkessel",United States,"February 1, 2019",2018,TV-14,88 min,"Horror Movies, Thrillers","A disparate group of teenage girls discovers how to obtain supernatural abilities, but abusing their newfound power has disturbing consequences."
4042,80199689,Movie,Velvet Buzzsaw,Dan Gilroy,"Jake Gyllenhaal, Rene Russo, Zawe Ashton, Toni Collette, John Malkovich, Natalia Dyer, Daveed Diggs, Tom Sturridge",United States,"February 1, 2019",2019,R,113 min,"Dramas, Thrillers","A feared critic, an icy gallery owner and an ambitious assistant snap up a recently deceased artist's stash of paintings – with dire consequences."
4047,80205451,Movie,42 Grams,Jack C. Newell,Jake Bickelhaupt,United States,"February 1, 2018",2017,TV-MA,81 min,Documentaries,"After launching a successful underground restaurant out of their apartment, an ambitious chef and his wife open an all-consuming upscale eatery."
4048,70045919,Movie,Æon Flux,Karyn Kusama,"Charlize Theron, Marton Csokas, Jonny Lee Miller, Sophie Okonedo, Frances McDormand, Pete Postlethwaite, Amelia Warner, Caroline Chikezie, Nikolai Kinski, Paterson Joseph, Yangzom Brauen",United States,"February 1, 2018",2005,PG-13,93 min,"Action & Adventure, Sci-Fi & Fantasy","Aiming to hasten an uprising, the leader of an underground rebellion dispatches acrobatic assassin Aeon Flux to eliminate the government's top leader."
4049,80141928,Movie,Before the Flood,Fisher Stevens,Leonardo DiCaprio,United States,"February 1, 2018",2016,PG,97 min,Documentaries,Leonardo DiCaprio crisscrosses the globe to investigate the consequences of man-made globe warming and the measures being taken to reverse it.
4059,80217040,Movie,National Parks Adventure,Greg MacGillivray,Robert Redford,United States,"February 1, 2018",2016,TV-G,42 min,Documentaries,"Narrated by Robert Redford, this documentary tours the awe-inspiring landscapes, historic sites and untamed wilderness of America's great parks."
4060,80172958,Movie,Newness,Drake Doremus,"Nicholas Hoult, Laia Costa, Danny Huston, Courtney Eaton, Matthew Gray Gubler, Albert Hammond Jr.",United States,"February 1, 2018",2017,TV-MA,117 min,"Dramas, Independent Movies, Romantic Movies","Martin and Gabi try to form a relationship after meeting through a hookup app, but when boredom creeps in, they seek out an unconventional solution."
4061,80171291,Movie,Paint It Black,Amber Tamblyn,"Alia Shawkat, Janet McTeer, Rhys Wakefield, Alfred Molina, Emily Rios, Nancy Kwan, John Roberts, Annabelle Attanasio, Ken Davitian",United States,"February 1, 2018",2016,R,96 min,Dramas,"In the wake of a young artist’s suicide, his pianist mother and his despairing girlfriend square off in a living nightmare beset by guilt and blame."
4074,80127604,Movie,Indiscretion,John Stewart Muller,"Mira Sorvino, Cary Elwes, Christopher Backus, Katherine McNamara, Lisa Gay Hamilton, Melora Walters, Buck Taylor, Shane Callahan",United States,"February 1, 2017",2016,TV-MA,99 min,"Dramas, Thrillers","After a weekend fling with artist Victor, Veronica, a psychiatrist and politician's wife, becomes the target of Victor's dangerous romantic obsession."
4080,80152745,Movie,The Hurt Business,Vlad Yudin,Kevin Costner,United States,"February 1, 2017",2016,PG-13,111 min,"Documentaries, Sports Movies","Featuring legendary and up-and-coming MMA fighters, this documentary details the history of the brutal sport and the fighters' struggles and triumphs."
4085,81004748,Movie,A Family Reunion Christmas,Robbie Countryman,"Loretta Devine, Tia Mowry-Hardrict, Anthony Alabi, Talia Jackson, Isaiah Russell-Bailey, Cameron J. Wright, Jordyn Raya James, Jackée Harry, Richard Roundtree",United States,"December 9, 2019",2019,TV-PG,29 min,Movies,M'Dear and her sisters struggle to keep their singing act together before a church Christmas pageant while Grandpa teaches the kids a valuable lesson.
4086,80174959,Movie,It Comes at Night,Trey Edward Shults,"Joel Edgerton, Christopher Abbott, Carmen Ejogo, Riley Keough, Kelvin Harrison Jr., David Pendleton, Griffin Robert Faulkner",United States,"December 9, 2019",2017,R,92 min,"Horror Movies, Independent Movies","As danger stalks the world outside his isolated home, an overprotective father faces a tough decision when another family shows up seeking help."
4090,80160347,Movie,Mariah Carey's Merriest Christmas,James Yukich,"Mariah Carey, Lacey Chabert, Kelsey Grammer, Billy Gardell, Fina Strazza, Kenneth Edmonds, Cameron Mathison, Brennan Elliott",United States,"December 9, 2016",2015,TV-G,38 min,"Children & Family Movies, Music & Musicals","Pop music superstar Mariah Carey hosts this all-star holiday celebration with special guests and a celebrity reading of ""The Night Before Christmas."""
4103,80178974,Movie,El Camino Christmas,David E. Talbert,"Jessica Alba, Tim Allen, Dax Shepard, Vincent D'Onofrio, Luke Grimes, Kurtwood Smith, Michelle Mylett",United States,"December 8, 2017",2017,TV-MA,89 min,"Comedies, Dramas","Stuck in a liquor store during an alleged robbery, a group of strangers shares hidden truths and forms an unexpected bond on Christmas Eve."
4112,80103392,Movie,Kickboxer: Vengeance,John Stockwell,"Alain Moussi, Jean-Claude Van Damme, Dave Bautista, Gina Carano, Georges St-Pierre, Sara Malakul Lane, Matthew Ziff, T.J. Storm, Fabricio Werdum, Cain Velasquez",United States,"December 8, 2016",2016,TV-MA,90 min,Action & Adventure,"After a skilled fighter falls in the ring, his younger brother emerges from the shadows to train and get revenge against a brutal champion."
4114,80098288,Movie,Other People,Chris Kelly,"Jesse Plemons, Molly Shannon, Bradley Whitford, Maude Apatow, Madisen Beaty, John Early, Zach Woods, Paul Dooley, June Squibb",United States,"December 8, 2016",2016,NR,97 min,"Comedies, Dramas, Independent Movies","After a bad breakup, a struggling New York comedy writer tries to don a brave face and care for his dying mother in Sacramento."
4120,80201490,Movie,Dumplin',Anne Fletcher,"Danielle Macdonald, Jennifer Aniston, Odeya Rush, Maddie Baillio, Bex Taylor-Klaus, Luke Benward, Georgie Flores, Dove Cameron, Harold Perrineau, Kathy Najimy, Ginger Minj, Hilliary Begley",United States,"December 7, 2018",2018,PG-13,110 min,"Comedies, Dramas, Independent Movies","To prove a point about measuring up and fitting in, Texas teen Willowdean Dickson enters a local pageant run by her ex-beauty queen mom."
4126,81003741,Movie,The American Meme,Bert Marcus,"Paris Hilton, Josh Ostrovsky, Brittany Furlan, Kirill Bichutsky, DJ Khaled, Emily Ratajkowski, Hailey Baldwin",United States,"December 7, 2018",2018,TV-MA,98 min,Documentaries,"Social media stars Paris Hilton, Josh Ostrovsky, Brittany Furlan and Kirill Bichutsky hustle to build online empires – and face the pitfalls of fame."
4146,80185876,Movie,Trolls Holiday Special,Joel Crawford,"Anna Kendrick, Justin Timberlake, Zooey Deschanel, Christopher Mintz-Plasse, James Corden, Ron Funches, Kunal Nayyar, Aino Jawo, Caroline Hjelt, Walt Dohrn",United States,"December 6, 2017",2017,TV-G,27 min,"Children & Family Movies, Comedies, Music & Musicals","When Queen Poppy realizes that Bridget and the Bergens don't have any holidays, she hatches a plan for Branch and the Snack Pack to help create one."
4147,80117746,Movie,Blue Jay,Alex Lehmann,"Sarah Paulson, Mark Duplass, Clu Gulager",United States,"December 6, 2016",2016,TV-MA,81 min,"Dramas, Independent Movies, Romantic Movies","Two former high school sweethearts unexpectedly reunite in their old hometown, where they rediscover their magical bond and face a shared regret."
4148,80142615,Movie,One in a Billion,Roman Gackowski,"Satnam Singh Bhamara, Mark Cuban, Adam Silver, Vivek Ranadivé",United States,"December 6, 2016",2016,TV-PG,70 min,"Documentaries, Sports Movies",Follow the journey of Satnam Singh Bhamara as he works to fulfill his dream of becoming the first India-born player to be drafted into the NBA.
4149,80115673,Movie,Reggie Watts: Spatial,Benjamin Dickinson,Reggie Watts,United States,"December 6, 2016",2016,TV-MA,62 min,"Music & Musicals, Stand-Up Comedy","The comic innovator delivers a surreal set blending experimental songs, jokes about grits, guns and drugs, and other improvised comedy adventures."
4158,80187435,Movie,Craig Ferguson: Tickle Fight,Jay Chapman,Craig Ferguson,United States,"December 5, 2017",2017,TV-MA,67 min,Stand-Up Comedy,"Cheeky comic Craig Ferguson keeps it casual as he discusses '70s porn, Japanese toilets and his mildly crime-filled days as a talk show host."
4159,80104103,Movie,The Good Neighbor,Kasra Farahani,"James Caan, Logan Miller, Keir Gilchrist, Laura Innes, Edwin Hodge, Anne Dudek, Bailey Noble, Lili Reinhart, Mindy Sterling",United States,"December 5, 2016",2016,TV-MA,97 min,"Dramas, Independent Movies, Thrillers","Two tech-savvy teens plot to fool a cranky old neighbor into believing his house is haunted, but their cruel prank soon takes some unexpected turns."
4160,80004478,Movie,Bill Burr: I'm Sorry You Feel That Way,Jay Karas,Bill Burr,United States,"December 5, 2014",2014,NR,81 min,Stand-Up Comedy,"Bill Burr escapes the zombie apocalypse, explores how rom-coms ruin great sex and explains how too many childhood hugs may be the downfall of man."
4164,80211590,Movie,God's Not Dead: A Light in Darkness,Michael Mason,"David A.R. White, John Corbett, Shane Harper, Ted McGinley, Jennifer Taylor, Benjamin A. Onyango, Tatum O'Neal, Cissy Houston",United States,"December 4, 2018",2018,PG,106 min,"Dramas, Faith & Spirituality","After a fire breaks out at his church, a pastor faces a legal battle against university leaders who wish to push the congregation off the campus."
4168,80042368,Movie,A Very Murray Christmas,Sofia Coppola,"Bill Murray, Miley Cyrus, George Clooney, Chris Rock, Amy Poehler, Michael Cera, Maya Rudolph, Rashida Jones, Jason Schwartzman, Paul Shaffer, Jenny Lewis, Phoenix",United States,"December 4, 2015",2015,TV-14,57 min,"Comedies, Music & Musicals","Bill Murray rounds up an all-star cast for an evening of music, mischief and barroom camaraderie in this irreverent twist on holiday variety shows."
4187,372195,Movie,Child's Play,Tom Holland,"Catherine Hicks, Alex Vincent, Brad Dourif, Chris Sarandon, Dinah Manoff, Tommy Swerdlow, Jack Colvin, Neil Giuntoli, Juan Ramírez, Alan Wilder",United States,"December 31, 2019",1988,R,87 min,"Cult Movies, Horror Movies","When a rash of murders unfolds, 6-year-old Andy knows that his toy doll Chucky is the killer, but neither his mom nor the cops believe him."
4199,60020236,Movie,Heartbreakers,David Mirkin,"Sigourney Weaver, Jennifer Love Hewitt, Ray Liotta, Jason Lee, Gene Hackman, Anne Bancroft, Jeffrey Jones, Nora Dunn, Ricky Jay, Zach Galifianakis",United States,"December 31, 2019",2001,PG-13,124 min,"Comedies, Romantic Movies","In this stylish comedy, a mother-daughter con team makes money the old-fashioned way: They use their feminine wiles to swindle it."
4201,81109078,Movie,How High 2,Bruce Leddy,"Lil Yachty, D.C. Young Fly, Alyssa Goss, DeRay Davis, Mary Lynn Rajskub, Blac Youngsta, Lil Baby, NeNe Leakes, Mike Epps, Al Shearer",United States,"December 31, 2019",2019,TV-MA,89 min,Comedies,"When a pair of friends uncover a weed Bible, their magical stash gets stolen, sending them on a pot-fueled quest through Atlanta to find it."
4223,896678,Movie,Red Dawn,John Milius,"Patrick Swayze, C. Thomas Howell, Lea Thompson, Charlie Sheen, Darren Dalton, Jennifer Grey, Brad Savage, Doug Toby, Ben Johnson, Harry Dean Stanton",United States,"December 31, 2019",1984,PG-13,114 min,"Action & Adventure, Cult Movies",A group of teenagers witnesses Soviet and Cuban paratroopers descending on their small Colorado town and systematically setting off World War III.
4247,70043231,Movie,Bill Hicks: Sane Man,"Kevin Booth, David Johndrow",Bill Hicks,United States,"December 31, 2018",1989,NR,81 min,Stand-Up Comedy,"Filmed in 1989 at a turning point in comedian Bill Hicks's career, this rare onstage performance captures him spouting off on a variety of topics."
4254,60004393,Movie,Sam Kinison: Breaking the Rules,Walter C. Miller,Sam Kinison,United States,"December 31, 2018",1987,TV-MA,50 min,Stand-Up Comedy,"The one-time preacher shakes and shudders as he tears into subjects including sex, marriage, religion, drugs and famine in this HBO special."
4255,70026468,Movie,Sam Kinison: Family Entertainment Hour,Walter C. Miller,Sam Kinison,United States,"December 31, 2018",1991,TV-MA,49 min,Stand-Up Comedy,"Comic Sam Kinison lets it rip with this performance at L.A.'s Wiltern theatre, skewering every segment of modern society from religion to television."
4261,81031650,Movie,The Bill Murray Stories: Life Lessons Learned From a Mythical Man,Tommy Avallone,"Tommy Avallone, Bill Murray, Joel Murray, Peter Farrelly",United States,"December 31, 2018",2018,TV-MA,72 min,Documentaries,"This documentary highlights spontaneous encounters with the elusive, comedic veteran, who touches lives by simply showing up anywhere."
4263,81045509,Movie,Tim Allen: Men Are Pigs,Ellen Brown,Tim Allen,United States,"December 31, 2018",1990,TV-14,30 min,Stand-Up Comedy,"Standup comedian Tim Allen delivers a set dedicated to ""men stuff"" like lawn care, power tools and why he grunts like an animal."
