,show_id,type,title,director,cast,country,date_added,release_year,rating,duration,listed_in,description
4,80125979,Movie,#realityhigh,Fernando Lebrija,"Nesta Cooper, Kate Walsh, John Michael Higgins, Keith Powers, Alicia Sanz, Jake Borelli, Kid Ink, Yousef Erakat, Rebekah Graf, Anne Winters, Peter Gilroy, Patrick Davis",United States,"September 8, 2017",2017,TV-14,99 min,Comedies,"When nerdy high schooler Dani finally attracts the interest of her longtime crush, she lands in the cross hairs of his ex, a social media celebrity."
20,80060297,Movie,Manhattan Romance,Tom O'Brien,"Tom O'Brien, Katherine Waterston, Caitlin Fitzgerald, Gaby Hoffmann, Louis Cancelmi, Zach Grenier",United States,"September 8, 2017",2014,TV-14,98 min,"Comedies, Independent Movies, Romantic Movies",A filmmaker working on a documentary about love in modern Manhattan becomes personally entangled in the romantic lives of his subjects.
23,70304988,Movie,Stonehearst Asylum,Brad Anderson,"Kate Beckinsale, Jim Sturgess, David Thewlis, Brendan Gleeson, Ben Kingsley, Michael Caine, Jason Flemyng, Sophie Kennedy Clark, Sinéad Cusack, Edmund Kingsley",United States,"September 8, 2017",2014,PG-13,113 min,"Horror Movies, Thrillers","In 1899, a young doctor arrives at an asylum for an apprenticeship and becomes suspicious of his mentor's methods while falling for a female patient."
24,80057700,Movie,The Runner,Austin Stark,"Nicolas Cage, Sarah Paulson, Connie Nielsen, Wendell Pierce, Bryan Batt, Peter Fonda, Dana Gourrier",United States,"September 8, 2017",2015,R,90 min,"Dramas, Independent Movies",A New Orleans politician finds his idealistic plans for rebuilding after a toxic oil spill unraveling thanks to a sex scandal.
25,80045922,Movie,6 Years,Hannah Fidell,"Taissa Farmiga, Ben Rosenfield, Lindsay Burdge, Joshua Leonard, Jennifer Lafleur, Peter Vack, Dana Wheeler-Nicholson, Jason Newman, Molly McMichael",United States,"September 8, 2015",2015,NR,80 min,"Dramas, Independent Movies, Romantic Movies","As a volatile young couple who have been together for six years approach college graduation, unexpected career opportunities threaten their future."
31,80239639,Movie,Sierra Burgess Is A Loser,Ian Samuels,"Shannon Purser, Kristine Froseth, RJ Cyler, Noah Centineo, Loretta Devine, Giorgia Whigham, Alice Lee, Lea Thompson, Alan Ruck, Mary Pat Gleason, Chrissy Metz",United States,"September 7, 2018",2018,PG-13,106 min,"Comedies, Romantic Movies",A wrong-number text sparks a virtual romance between a smart but unpopular teen and a sweet jock who thinks he's talking to a gorgeous cheerleader.
40,80058026,Movie,Hell and Back,"Tom Gianas, Ross R. Shuman","Nick Swardson, Mila Kunis, Bob Odenkirk, T.J. Miller, Rob Riggle, Susan Sarandon, Danny McBride, Jennifer Coolidge, John Farley, Maria Bamford",United States,"September 6, 2018",2015,R,86 min,"Action & Adventure, Comedies, Independent Movies","When best friends break a blood oath, one of them is cast away to hell, and the other two must save him from the misfits of the underworld."
52,80147760,Movie,Carrie Pilby,Susan Johnson,"Bel Powley, Nathan Lane, Vanessa Bayer, Gabriel Byrne, Jason Ritter, Colin O'Donoghue, William Moseley, Desmin Borges",United States,"September 5, 2017",2016,TV-14,98 min,"Comedies, Dramas","A socially awkward 19-year-old genius makes big plans to step out of her shell and make a friend, get a job and – maybe – even go on a date."
53,80177405,Movie,Marc Maron: Too Real,Lynn Shelton,Marc Maron,United States,"September 5, 2017",2017,TV-MA,70 min,Stand-Up Comedy,"Battle-scarred stand-up comedian Marc Maron unleashes a storm of ideas about meditation, mortality, documentary films and our weird modern world."
57,81078908,Movie,The World We Make,Brian Baugh,"Caleb Castille, Rose Reid, Kevin Sizemore, Gregory Alan Williams",United States,"September 4, 2019",2019,PG,108 min,"Dramas, Romantic Movies","A teenage equestrian and a local football player for each other, but simmering racism in their small town puts their relationship to the test."
59,80201906,Movie,Black Panther,Ryan Coogler,"Chadwick Boseman, Michael B. Jordan, Lupita Nyong'o, Danai Gurira, Martin Freeman, Daniel Kaluuya, Letitia Wright, Winston Duke, Sterling K. Brown, Angela Bassett, Forest Whitaker, Andy Serkis, Florence Kasumba, John Kani, David S. Lee, Stan Lee",United States,"September 4, 2018",2018,PG-13,135 min,"Action & Adventure, Sci-Fi & Fantasy","T'Challa, the superpowered new leader of the hidden, highly advanced African nation of Wakanda, strives to protect his home from enemies old and new."
78,80128722,Movie,Gerald's Game,Mike Flanagan,"Carla Gugino, Bruce Greenwood, Henry Thomas, Carel Struycken, Chiara Aurelia",United States,"September 29, 2017",2017,TV-MA,103 min,"Horror Movies, Thrillers","When her husband's sex game goes wrong, Jessie – handcuffed to a bed in a remote lake house – faces warped visions, dark secrets and a dire choice."
81,80104068,Movie,Our Souls at Night,Ritesh Batra,"Robert Redford, Jane Fonda, Bruce Dern, Matthias Schoenaerts, Iain Armitage, Judy Greer, Phyllis Somerville",United States,"September 29, 2017",2017,TV-14,103 min,"Dramas, Romantic Movies","After widowed neighbors Addie and Louis begin sleeping in bed together platonically to alleviate their loneliness, a real romance begins to blossom."
85,80019931,Movie,"Monster High: Boo York, Boo York",William Lau,"Karen Strassman, Celeste Henderson, Wendee Lee, TJ Smith, America Young, Rachel Staman, Laura Bailey",United States,"September 29, 2015",2015,TV-Y7,72 min,"Children & Family Movies, Music & Musicals",Cleo is invited to a gala in the big city celebrating a magical comet and brings her best friends along. But the sinister Nefera has other plans.
91,80157072,Movie,Hold the Dark,Jeremy Saulnier,"Jeffrey Wright, Alexander Skarsgård, James Badge Dale, Riley Keough, Julian Black Antelope, Tantoo Cardinal, Macon Blair, Jonathan Whitesell, Peter McRobbie",United States,"September 28, 2018",2018,TV-MA,126 min,"Action & Adventure, Dramas","In the grim Alaskan winter, a naturalist hunts for wolves blamed for killing a local boy, but he soon finds himself swept into a chilling mystery."
102,80231903,Movie,In the Shadow of the Moon,Jim Mickle,"Boyd Holbrook, Michael C. Hall, Cleopatra Coleman, Bokeem Woodbine, Rudi Dharmalingam, Rachel Keller",United States,"September 27, 2019",2019,TV-MA,116 min,"Dramas, Sci-Fi & Fantasy, Thrillers",A Philadelphia detective slowly unravels as he nurses a lifelong obsession with an enigmatic female serial killer whose crimes defy explanation.
108,60003155,Movie,Joseph: King of Dreams,"Rob LaDuca, Robert C. Ramirez","Ben Affleck, Mark Hamill, Richard Herd, Maureen McGovern, Jodi Benson, Judith Light, James Eckhouse, Richard McGonagle, David Campbell, Steven Weber, Dan Castellaneta, Rene Auberjonois, Ken Hudson Campbell, Tom Virtue, Jeff Bennett",United States,"September 27, 2011",2000,TV-PG,75 min,"Children & Family Movies, Dramas, Faith & Spirituality","With his gift of dream interpretation and his brilliantly colored coat, Joseph inspires jealousy in his brothers in this animated Bible story."
112,80215923,Movie,The Hurricane Heist,Rob Cohen,"Toby Kebbell, Maggie Grace, Ryan Kwanten, Ralph Ineson, Melissa Bolona, Ben Cross, Jamie Andrew Cutler",United States,"September 26, 2018",2018,PG-13,103 min,Action & Adventure,A deadly hurricane with mile-high waves provides the perfect cover for stealing $600 million from a U.S. Treasury outpost in Mississippi.
113,80151483,Movie,Def Comedy Jam 25,Louis J. Horvitz,"Dave Chappelle, Steve Harvey, Cedric the Entertainer, Martin Lawrence, Tiffany Haddish, Katt Williams, Craig Robinson, D.L. Hughley, Eddie Griffin, J.B. Smoove, Joe Torry, Kid Capri, Mike Epps, Sheryl Underwood, Tracy Morgan, Deon Cole",United States,"September 26, 2017",2017,TV-MA,82 min,Stand-Up Comedy,"In this special live event, giants of stand-up come together to commemorate the 25th anniversary of Russell Simmons's groundbreaking ""Def Comedy Jam."""
114,80173625,Movie,Restless Creature: Wendy Whelan,"Linda Saffire, Adam Schlesinger","Peter Martins, Sean Suozzi, Gretchen Smith, Ashley Laracey, Tiler Peck, Damian Woetzel, Albert Evans, Sterling Hyltin, Craig Hall, Peter Boal, Karen Young, Michelle Rodriguez, Jock Soto, Adam Barrett",United States,"September 26, 2017",2016,TV-MA,94 min,Documentaries,"After 30 years with the New York City Ballet, celebrated dancer Wendy Whelan redefines herself as an artist in a new stage of life."
121,80108976,Movie,USS Indianapolis: Men of Courage,Mario Van Peebles,"Nicolas Cage, Tom Sizemore, Thomas Jane, Matt Lanter, James Remar, Brian Presley, Johnny Wactor, Adam Scott Miller, Cody Walker, Callard Harris",United States,"September 25, 2019",2016,R,130 min,Action & Adventure,"After becoming stranded in the Philippine Sea during World War II, a tenacious Navy crew faces a dire lack of supplies and a string of shark attacks."
122,80208155,Movie,A Wrinkle in Time,Ava DuVernay,"Storm Reid, Oprah Winfrey, Reese Witherspoon, Mindy Kaling, Deric McCabe, Levi Miller, Chris Pine, Gugu Mbatha-Raw, Zach Galifianakis, Michael Peña, Bellamy Young, André Holland, Will McCormack, Rowan Blanchard, Daniel MacPherson",United States,"September 25, 2018",2018,PG,110 min,Children & Family Movies,"Years after their father disappears, Meg and her younger brother Charles Wallace cross galaxies on a quest to save him from the heart of darkness."
125,81053953,Movie,Inside Man: Most Wanted,Michael J. Bassett,"Aml Ameen, Rhea Seehorn, Roxanne McKee, Urs Rechn, Akshay Kumar, Tanya van Graan, Andre Jacobs, Sven Ruygrok",United States,"September 24, 2019",2019,R,106 min,Action & Adventure,A hotshot NYPD negotiator butts heads with the FBI and meets his match in a meticulous criminal mastermind as she attempts to rob the Federal Reserve.
126,81074113,Movie,Jeff Dunham: Beside Himself,Troy Miller,Jeff Dunham,United States,"September 24, 2019",2019,TV-MA,58 min,Stand-Up Comedy,"Jeff Dunham takes the stage in Dallas with his old pals Peanut, Walter, José Jalapeño, Bubba J and Achmed to poke fun at himself and American culture."
132,80208906,Movie,Under the Eiffel Tower,Archie Borders,"Matt Walsh, Judith Godreche, Reid Scott, Michaela Watkins, David Wain, Gary Cole",United States,"September 23, 2019",2018,TV-MA,87 min,"Comedies, Independent Movies, Romantic Movies",An American man in the midst of a mid-life crisis travels to the French countryside to find a new lease on life.
134,80106966,Movie,Iliza Shlesinger: Confirmed Kills,Bobcat Goldthwait,Iliza Shlesinger,United States,"September 23, 2016",2016,TV-MA,78 min,Stand-Up Comedy,"The stand-up sensation tackles TV's ""Shark Tank,"" what it means to be a woman and how to deal with the lawless party goblin that lives in us all."
137,70267838,Movie,20 Feet From Stardom,Morgan Neville,"Darlene Love, Merry Clayton, Lisa Fischer, Táta Vega, Claudia Lennear, Judith Hill, Bruce Springsteen, Mick Jagger, Stevie Wonder, Sting, Bette Midler, Cissy Houston, Sheryl Crow, Tata Vega",United States,"September 22, 2018",2013,PG-13,91 min,"Documentaries, Music & Musicals","Winner of the 2014 Academy Award for Best Documentary Feature, this film takes a look at the world of backup vocalists and the legends they support."
139,80196586,Movie,Gaga: Five Foot Two,Chris Moukarbel,Lady Gaga,United States,"September 22, 2017",2017,TV-MA,101 min,"Documentaries, Music & Musicals","Follow pop provocateur Lady Gaga as she releases a new album, preps for her Super Bowl halftime show, and confronts physical and emotional struggles."
140,80099204,Movie,The Bad Batch,Ana Lily Amirpour,"Suki Waterhouse, Jason Momoa, Keanu Reeves, Jim Carrey, Giovanni Ribisi, Yolonda Ross",United States,"September 22, 2017",2016,R,119 min,"Dramas, Independent Movies, Thrillers","Banished to a wasteland of undesirables, a young woman struggles to find her feet among a drug-soaked desert society and an enclave of cannibals."
141,80059432,Movie,SMOSH: The Movie,Alex Winter,"Ian Hecox, Anthony Padilla, Jenna Marbles, Grace Helbig, Harley Morenstein, Jillian Nelson, Brittany Ross, Michael Ian Black, Steve Austin",United States,"September 22, 2015",2015,PG-13,83 min,Comedies,"To keep his teen crush from spotting him in an embarrassing YouTube video, Anthony and his friend Ian must enter the virtual world and alter the clip."
151,80102952,Movie,Quincy,"Rashida Jones, Alan Hicks",Quincy Jones,United States,"September 21, 2018",2018,TV-MA,124 min,"Documentaries, Music & Musicals","This documentary profiles music and culture icon Quincy Jones, offering unprecedented access to his private life and stories from his unparalleled career."
154,80243600,Movie,Between Two Ferns: The Movie,Scott Aukerman,"Zach Galifianakis, Lauren Lapkus, Ryan Gaul, Jiavani Linayao, Will Ferrell",United States,"September 20, 2019",2019,TV-MA,83 min,Comedies,"Armed with awkward questions and zero self-awareness, Zach Galifianakis hits the road to find famous interview subjects for his no-budget talk show."
159,81122669,Movie,Daddy Issues,Amara Cash,"Madison Lawlor, Montana Manning, Andrew Pifko, Monte Markham, Kamala Jones, Jodi Carol Harrison, Seth Cassell, Ronnie Clark, Lissa Danshaw, J.J. Hawkins",United States,"September 20, 2019",2019,TV-MA,82 min,"Dramas, Independent Movies, LGBTQ Movies","Maya finally hooks up with her online dream girl, only to discover she’s deeply involved with an older sugar daddy – a man Maya knows all too well."
173,80161931,Movie,Vincent N Roxxy,Gary Michael Schultz,"Emile Hirsch, Zoë Kravitz, Emory Cohen, Zoey Deutch, Beau Knapp, Jason Mitchell, Scott Mescudi, Jeff Gum, Joey Bicicchi",United States,"September 2, 2017",2016,R,101 min,"Dramas, Thrillers","In rural Louisiana, a terse loner forges a redemptive bond with a woman he saved from a killer, but a violent past soon catches up with both of them."
179,80190449,Movie,The Endless,"Justin Benson, Aaron Moorhead","Aaron Moorhead, Justin Benson, Callie Hernandez, Lew Temple, James Jordan, Tate Ellington",United States,"September 19, 2018",2017,TV-MA,112 min,"Independent Movies, Sci-Fi & Fantasy, Thrillers","As kids, they escaped a UFO death cult. Now, two adult brothers seek answers after an old videotape surfaces and brings them back to where they began."
181,80163156,Movie,Jerry Before Seinfeld,Michael Bonfiglio,Jerry Seinfeld,United States,"September 19, 2017",2017,TV-14,62 min,Stand-Up Comedy,"Jerry Seinfeld returns to the club that gave him his start in the 1970s, mixing iconic jokes with stories from his childhood and early days in comedy."
191,80987075,Movie,Class Rank,Eric Stoltz,"Olivia Holt, Skyler Gisondo, Kristin Chenoweth, Bruce Dern, Nick Krause, Kathleen Chalfant, Peter Maloney, Rod McLachlan, Hawn Tran, Danni Wang",United States,"September 18, 2018",2018,TV-14,103 min,Comedies,"When her class rank threatens her college plans, an ambitious teen convinces a nerdy peer to run for the school board to abolish the ranking system."
192,80192815,Movie,Barbie Dolphin Magic,Conrad Helten,"Erica Lindbeck, Shannon Chan-Kent, Kazumi Evans, Claire Corlett, Ciana Swales, Adrian Petriw, Maryke Hendrikse, Paul Dobson, Garry Chalk",United States,"September 18, 2017",2017,TV-G,64 min,Children & Family Movies,"While visiting Ken and exploring a coral reef, Barbie and her sisters make an amazing discovery and meet a mysterious new friend."
196,80066798,Movie,Keith Richards: Under the Influence,Morgan Neville,Keith Richards,United States,"September 18, 2015",2015,TV-PG,82 min,"Documentaries, Music & Musicals","In a documentary with unparalleled access, discover the people and sounds that inspired rock 'n' roll legend Keith Richards from childhood to today."
197,81147293,Movie,A Haunting at Silver Falls: The Return,Teo Konuralp,"Laura Flannery, James Cavlo, Harry Hains, Clemmie Dugdale, Dendrie Taylor, Bryan Chesters, Jennifer Dorogi, Adam Lazarre-White, Nikita Ramsey",United States,"September 17, 2019",2019,TV-14,80 min,"Horror Movies, Independent Movies","When the ghost of her serial killer aunt seemingly resurfaces, Jordan must return to Silver Falls in hopes of finally putting an end to the torment."
200,80190588,Movie,Clive Davis: The Soundtrack of Our Lives,Chris Perkel,Clive Davis,United States,"September 17, 2019",2017,TV-14,124 min,"Documentaries, Music & Musicals",This music-driven documentary charts Clive Davis' 50-year career as one of the world's most influential record moguls.
202,70229037,Movie,Sebastian Maniscalco: What's Wrong with People?,Manny Rodriguez,Sebastian Maniscalco,United States,"September 17, 2019",2012,TV-14,76 min,Stand-Up Comedy,"With his uproarious tirade on modern behavior and decorum, the popular comic tackles the question we've all asked in this hilarious standup special."
206,80058248,Movie,I Am Wrath,Chuck Russell,"John Travolta, Christopher Meloni, Amanda Schull, Sam Trammell, Patrick St. Esprit, Rebecca De Mornay, Asante Jones, Paul Sloan, Luis Da Silva Jr., Jordan Whalen",United States,"September 16, 2019",2016,R,91 min,"Action & Adventure, Dramas","Hell-bent on avenging his wife's murder, Stanley Hill summons an old partner's help in exposing a cover-up by crooked cops and slimy politicians."
207,70307661,Movie,"As Above, So Below",John Erick Dowdle,"Perdita Weeks, Ben Feldman, Edwin Hodge, François Civil, Marion Lambert, Ali Marhyar, Cosme Castro, Hamid Djavadan, Théo Cholbi, Emy Lévy",United States,"September 16, 2018",2014,R,93 min,"Horror Movies, Thrillers",A beautiful tomb raider and her crew hunt for treasure in the catacombs of Paris and find themselves in a hellish underworld.
210,80108371,Movie,Cedric the Entertainer: Live from the Ville,Troy Miller,Cedric the Entertainer,United States,"September 16, 2016",2016,TV-MA,60 min,Stand-Up Comedy,"Donning his signature suit and fedora, the dapper comic offers a unique spin on getting old, the presidential election and ""Honky Tonk Badonkadonk."""
217,81030342,Movie,Los Tigres del Norte at Folsom Prison,Tom Donahue,Los Tigres del Norte,United States,"September 15, 2019",2019,TV-PG,64 min,"Documentaries, International Movies, Music & Musicals",The beloved norteño band Los Tigres del Norte performs for the inmates of Folsom Prison on the 50th anniversary of Johnny Cash's iconic concert.
219,70054723,Movie,Steal a Pencil for Me,Michèle Ohayon,"Jack Polak, Ina Soep",United States,"September 15, 2019",2006,TV-14,94 min,Documentaries,This moving documentary chronicles the unshakeable romance between a couple who met and fell in love while imprisoned in a Nazi concentration camp.
222,81131761,Movie,The Outsider,Timothy Woodward Jr.,"Jon Foo, Trace Adkins, Sean Patrick Flanery, Kaiwi Lyman, Nelli Tsay, Danny Trejo, Mitchell L. Johnson, Philip V. Bruenn",United States,"September 15, 2019",2019,TV-MA,86 min,Movies,A frontier sheriff tries to protect his sadistic son from a Chinese railroad worker hellbent on revenge.
248,80088910,Movie,Natural Born Pranksters,"Roman Atwood, Ben Pluimer","Roman Atwood, Vitaly Zdorovetskiy, Dennis Roady",United States,"September 15, 2016",2016,R,91 min,Comedies,"The biggest pranksters on YouTube – VitalyzdTV, Dennis Roady and Roman Atwood – turn Hollywood into ""Prankwood"" with their most over-the-top stunts."
249,70290909,Movie,Sample This,Dan Forrer,Gene Simmons,United States,"September 15, 2016",2012,TV-14,83 min,"Documentaries, Music & Musicals","This doc traces the impact of the Incredible Bongo Band's ""Apache,"" which played a key role in the birth of hip-hop after Kool Herc began sampling it."
251,80033772,Movie,Cowspiracy: The Sustainability Secret,"Kip Andersen, Keegan Kuhn",Kip Andersen,United States,"September 15, 2015",2014,NR,90 min,Documentaries,Learn how factory farming is decimating the planet's natural resources – and why this crisis has been largely ignored by major environmental groups.
253,80238013,Movie,The Crystal Calls Making the Dark Crystal: Age of Resistance,Randall Lobb,"Taron Egerton, Natalie Dormer, Simon Pegg, Jason Isaacs",United States,"September 14, 2019",2019,TV-PG,83 min,"Documentaries, International Movies","Go behind the scenes with stars, puppeteers and creators as they bring Jim Henson's magical world of Thra back to life in a sweeping fantasy series."
254,81089941,Movie,We Have Always Lived in the Castle,Stacie Passon,"Taissa Farmiga, Alexandra Daddario, Crispin Glover, Sebastian Stan, Paula Malcomson, Peter Coonan, Ian Toner, Joanne Crawford",United States,"September 14, 2019",2018,TV-14,95 min,"Dramas, Thrillers",The fragile and secretive world of two sisters and their uncle crumbles when their charming cousin arrives with eyes toward the family fortune.
264,80164779,Movie,The Land of Steady Habits,Nicole Holofcener,"Ben Mendelsohn, Edie Falco, Connie Britton, Thomas Mann, Bill Camp, Elizabeth Marvel, Charlie Tahan, Michael Gaston, Josh Pais",United States,"September 14, 2018",2018,TV-MA,98 min,"Comedies, Dramas, Independent Movies","After leaving his wife and his job to find happiness, Anders begins a clumsy, heartbreaking quest to reassemble the pieces of his fractured life."
266,81092328,Movie,American Warfighter,Jerry G. Angelo,"Jerry G. Angelo, Paul Logan, Joshua Santana, Carolina Castro, David Robbins, Michael King, Tom Crisp, Jennifer Marshall, Victoria Clare, Ryan Baumann, Isaac C. Singleton Jr., Said Faraj",United States,"September 13, 2019",2019,TV-MA,106 min,Dramas,"A Navy SEAL haunted by wartime memories tries to rebuild his life at home, even as one last mission threatens to unravel everything."
267,81183572,Movie,Deviant Love,Michael Feifer,"Emma Bell, Nick Ballard, Bradley Bundlie, Gail O'Grady, Corbin Timbrook, Kate Lang Johnson, Robert Adamson, Caia Coley, Alicia James, Sotida Arpon",United States,"September 13, 2019",2019,TV-14,87 min,Thrillers,"In a tailspin after her marriage collapses, Jamie falls for a helpful gentleman whose interest in her welfare hides sinister motives."
268,81037283,Movie,Head Count,Elle Callahan,"Isaac Jay, Ashleigh Morghan, Bevin Bru, Billy Meade, Hunter Peterson, Chelcie May, Tory Freeth, Michael Herman, Amaka Obiechie, Sam Marra, Cooper Rowe",United States,"September 13, 2019",2018,TV-MA,90 min,"Horror Movies, Independent Movies",A group of college students on a weekend getaway accidentally summon a supernatural entity intent on using them for its deadly ritual.
269,80244973,Movie,"Hello, Privilege. It's Me, Chelsea",Alex Stapleton,Chelsea Handler,United States,"September 13, 2019",2019,TV-MA,65 min,Documentaries,"In this documentary, Chelsea Handler explores how white privilege impacts American culture – and the ways it’s benefited her own life and career."
275,81002412,Movie,Tall Girl,Nzingha Stewart,"Ava Michelle, Griffin Gluck, Sabrina Carpenter, Paris Berelc, Luke Eisner, Clara Wilsey, Anjelika Washington, Rico Paris, Angela Kinsey, Steve Zahn",United States,"September 13, 2019",2019,TV-PG,103 min,"Children & Family Movies, Comedies, Romantic Movies","After years of slouching through life, 6-foot-1 teen Jodi resolves to conquer her insecurities and gets caught up in a high school love triangle."
276,81023636,Movie,Time Trap,"Mark Dennis, Ben Foster","Andrew Wilson, Cassidy Gifford, Brianne Howey, Reiley McClendon, Olivia Draguicevich, Max Wright, Hans Marrero, Rich Skidmore, Chris Sturgeon, Gopal Bidari",United States,"September 13, 2019",2018,TV-14,88 min,"Action & Adventure, Sci-Fi & Fantasy","While searching for their missing archaeology professor, a group of students discovers a cave where time passes differently than it does on the surface."
280,80198046,Movie,Ghost of the Mountains,Ben Wallis,Antoine Fuqua,United States,"September 13, 2017",2017,G,78 min,Documentaries,An international group of filmmakers sets out on a mission to get up close and personal with a family of elusive snow leopards.
284,70267728,Movie,Turbo,David Soren,"Ben Schwartz, Bill Hader, Luis Guzmán, Snoop Dogg, Paul Giamatti, Ryan Reynolds, Maya Rudolph, Ken Jeong, Samuel L. Jackson, Michael Peña, Michelle Rodriguez, Richard Jenkins, Kurtwood Smith, Luis Guzman",United States,"September 12, 2019",2013,PG,96 min,"Children & Family Movies, Comedies",A speed-obsessed snail who dreams of being the world's greatest race car driver gets his chance when an accident imbues him with high-octane speed.
288,80158670,Movie,Jeff Dunham: Relative Disaster,Michael Simon,Jeff Dunham,United States,"September 12, 2017",2017,TV-MA,71 min,Stand-Up Comedy,Ventriloquist Jeff Dunham brings his rude and slightly demented posse of puppets to Ireland for a gleeful skewering of family and politics.
294,70130445,Movie,Eat Pray Love,Ryan Murphy,"Julia Roberts, James Franco, Javier Bardem, Richard Jenkins, Viola Davis, Billy Crudup, Hadi Subiyanto, Mike O'Malley, Tuva Novotny, Luca Argentero",United States,"September 10, 2019",2010,PG-13,140 min,"Dramas, Romantic Movies","After deciding to reshape her life after divorce, Liz travels around the world in search of good food, spirituality and true love."
298,80991570,Movie,"My Teacher, My Obsession",Damián Romay,"Lucy Loken, Laura Bilgeri, Rusty Joiner, Alexandria Deberry, Dakota Bruton, Theresa Sutera, Vin Morreale Jr., Shelby Alicea, Tyler Joseph Campbell, Lestonja Diaz",United States,"September 10, 2018",2018,TV-14,86 min,Thrillers,"When Riley changed schools, she didn't expect the girls to crush on her English teacher dad. And he didn't expect a disturbing infatuation."
299,80184129,Movie,68 Kill,Trent Haaga,"Matthew Gray Gubler, AnnaLynne McCord, Alisha Boe, Sheila Vand, Sam Eidson, James Moses Black, Ajay Mehta, Michael Beasley, David Maldonado, Hallie Grace Bradley, Peter Jaymes Jr., Eric Podnar, Lucy Faust",United States,"September 1, 2019",2017,R,96 min,"Comedies, Independent Movies, Thrillers",A hapless guy agrees to help his stunning – but psychotic – girlfriend rob her loathsome sugar daddy in a scheme as ill-conceived as it is violent.
